date,content,money
13/09/2024,Anh Yang Tu Thuy Le Van Nam Trung Quoc chuyen Tien Ung Ho Cac Ban Viet Nam Mien Bac Bao Lu,1800000
13/09/2024,CT nhanh 247 den: Vietinbank;111602391111;DAO VAN DUONG chuyen tien,1000000
13/09/2024,CT nhanh 247 den: LE THI THANH THUY CUU TRO MIEN BAC (CT1111),1000000
13/09/2024,CT nhanh 247 den: PHAM TIEN PHU chuyen tien (CT1111),100000
13/09/2024,Chuyen tien den tu NAPAS Noi dung: THUS INNOVATION ung ho (CT1111),5000000
13/09/2024,NGO THI NGAN Chuyen tien khac phuc bao so 3. Mong ba con binh an a. (CT1111),100000
13/09/2024,THU.NTA chuyen tien (CT1111),4000000
13/09/2024,Chuyen tien den tu NAPAS Noi dung: UNG HO DONG BAO BI THIEN TAI CON BAO SO 3-130924-09:55:01 059586 (ct1111),500000
13/09/2024,Chuyen tien den tu NAPAS Noi dung: VU HOANG NAM chuyen tien (ct1111),5000000
13/09/2024,Chuyen tien den tu NAPAS Noi dung: IBFT NGUYEN LENH DOAN ung ho dong bao (CT1111),100000
13/09/2024,CT nhanh 247 den: Vietinbank;CT1111;TRAN THI PHUONG chuyen tien ung ho dong bao bi thiet hai do bao Yagi gay ra (CT1111),500000
13/09/2024,Chuyen tien den tu NAPAS Noi dung: Ung ho dong bao bi thiet hai do bao Yagi (CT1111),2000000
13/09/2024,NGUYEN THI THUY chuyen tien (CT1111),100000
13/09/2024,Chuyen tien den tu NAPAS Noi dung: ho tro mien bac,100000
13/09/2024,"Chuyen tien den tu NAPAS Noi dung: Dong bao oi, co len FT24257720296052 (CT1111)",500000
13/09/2024,Chuyen tien den tu NAPAS Noi dung: Ung ho cuu tro bao (CT1111),5000000
13/09/2024,Chuyen tien den tu NAPAS Noi dung: IBFT Con xin ung ho dong bao sau con bao Yagi (CT1111),100000
13/09/2024,CT nhanh 247 den: Vietinbank;111602391111;PHAM THI SUONG chuyen tien ung ho ba con vung lu,50000
13/09/2024,CT nhanh 247 den: CAU MONG TAT CA MOI NGUOI DUOC BINH AN (CT1111),1000000
13/09/2024,Chuyen tien den tu NAPAS Noi dung: HOANG THE LAM ung ho dong bao lu lut FT24257270523726 (CT1111),200000
13/09/2024,PHAN THIEN TRUC chuyen tien ung ho cac tinh thanh pho bi thiet hai do bao so 3 gay ra,1000000
13/09/2024,CT nhanh 247 den: UNG HO DONG BAO LU SO 3,200000
13/09/2024,Chuyen tien den tu NAPAS Noi dung: JANE CHU UC - HO TRO DONG BAO LU LUT- 130924-09:55:27 060186,2000000
13/09/2024,NGUYEN THI THAO LINH Chuyen tien (CT1111),500000
13/09/2024,Chuyen tien den tu NAPAS Noi dung: Ung ho dong bao vung lu,500000
13/09/2024,Chuyen tien den tu NAPAS Noi dung: LY MINH CONG chuyen tien ho tro ba con mien bac FT24257710463213,2000000
13/09/2024,Gia dinh Phuc Chinh ung ho cuu tro mien Bac (CT1111),200000
13/09/2024,HUYNH THI NGOC MY chuyen tien,200000
13/09/2024,Chuyen tien den tu NAPAS Noi dung: TRAN VAN HUNG ung ho dong bao FT24257044028076 (CT1111),200000
13/09/2024,PHAM XUAN TINH ung ho nan nhan lu lut mien Bac (CT1111),100000
13/09/2024,chuc mien bac som vuot qua kho khan,100000
13/09/2024,DAO THI TUONG VI chuyen tien ung ho mien bac. mong moi nguoi binh an (CT1111),203253
13/09/2024,HOANG THU THUY Chuyen tien ung ho ba con vung bao lu (CT1111),200000
13/09/2024,dong gop cho nguoi dan bi anh huong bao so 3,200000
13/09/2024,NGUYEN ANH DUY chuyen tien,100000
13/09/2024,CT nhanh 247 den: NGUYEN THI THANH QUYNH CHUYEN TIEN UNG HO DONG BAO BAO LU (CT1111),500000
13/09/2024,CT nhanh 247 den: MBVCB.7020226679.046660.NGUYEN THI MY HANG ho tro khac phuc bao Yagi.,20000
13/09/2024,CT nhanh 247 den: lop 12xh1c Truong THPT CHI LANG UNG HO,500000
13/09/2024,ung ho dong bao mien bac lu lut,1000000
13/09/2024,CT nhanh 247 den: Vietinbank;CT1111;TRAN THI THU HONG chuyen tien ung ho dong bao bao yagy (CT1111),1000000
13/09/2024,CT nhanh 247 den: UNG HO DONG BAO THIET HAI DO CON BAO Yagi 20241309 (CT1111),400000
13/09/2024,Chuyen tien den tu NAPAS Noi dung: BUI DUC TUNG mua sach cho em vung lu,100000
13/09/2024,Chuyen tien den tu NAPAS Noi dung: DO XUAN TRUONG ung ho dong bao bao lu,200000
13/09/2024,Chuyen tien den tu NAPAS Noi dung: NGUYEN THI THUY QUYNH ung ho cuu tro lu lut FT24257509484080,200000
13/09/2024,PHAM VIET KHOI chuyen tien (CT1111),30000
13/09/2024,TRAN THI THAI NGUYEN Chuyen tien (CT1111),200000
13/09/2024,CT nhanh 247 den: HAN VAN LUAN UNG HO DONG BAO CHIU ANH HUONG CON BAO SO 3 MONG MOI DIEU BINH AN DEN MOI NGUOI,200000
13/09/2024,CT nhanh 247 den: UNG HO DONG BAO CHIU ANH HUONG THIEN TAI LU LUT. MONG MOI NGUOI BINH AN.,500000
13/09/2024,Chuyen tien den tu NAPAS Noi dung: HO TRO NHAN DAN VUNG LU LUT-130924- 09:56:17 061367 (CT1111),100000
13/09/2024,Chuc mn som vuot qua kho khan,12000
13/09/2024,CT nhanh 247 den: LE THANH TAN CHUYEN UNG HO BAO LUT (CT1111),300000
13/09/2024,Chuyen tien den tu NAPAS Noi dung: Ung ho dong bao Mien Bac FT24257062287250 (CT1111),100000
13/09/2024,Chung tay ung ho nguoi dan bao lu (CT1111),1000000
13/09/2024,NGUYEN THI LUA Ung ho dong bao vung lu lut (CT1111),500000
13/09/2024,Chuyen tien den tu NAPAS Noi dung: NGUYEN THI MAI chuyen tien ung ho ba con cua it long nhieu a (CT1111),100000
13/09/2024,NGUYEN THI LUOT ung ho mien bac,200000
13/09/2024,Chuyen tien den tu NAPAS Noi dung: DO THI CHUYEN chuyen tien FT24257431023046,50000
13/09/2024,CT nhanh 247 den: Con xin gop mot phan nho de giup do nguoi dan khac phuc hau qua bao so 3,20000
13/09/2024,CT nhanh 247 den: MBVCB.7020236318.052036.NGUYEN THU HUONG ung ho dong bao thiet hai do con bao so 3 .,100000
13/09/2024,Gia Dinh Hoan Hong ung ho (CT1111),100000
13/09/2024,Chuyen tien den tu NAPAS Noi dung: KHONG TIEN ANH HIEU chuyen tien qua MoMo (CT1111),20969
13/09/2024,VU XUAN TRUONG Chuyen tien,300000
13/09/2024,Chuyen tien den tu NAPAS Noi dung: Nguyen Nhat Ha ung ho nguoi dan bi bao lu so 3 Yagi (CT1111),2500000
13/09/2024,CT nhanh 247 den: NGUYEN PHUONG THANH chuyen tien (CT1111),30000
13/09/2024,CT nhanh 247 den: NGUYEN THI THU chuyen tien (CT1111),200000
13/09/2024,CT nhanh 247 den: MBVCB.7020232163.052335.DO VIET ANH ung ho dong bao mien bac.,500000
13/09/2024,cua it long nhieu; mong moi nguoi vuot qua kho khan (CT1111),50000
13/09/2024,Chuyen tien den tu NAPAS Noi dung: MB co len (CT1111),50000
13/09/2024,CT nhanh 247 den: HA TRUONG THI MY DUYEN gui ba con mien bac khac phuc sau lu (CT1111),500000
13/09/2024,CT nhanh 247 den: NGUYEN THI KHANH MINH xin ung ho dong bao bi thiet hai,20000
13/09/2024,Chuyen tien den tu NAPAS Noi dung: Ung ho dong bao minh chong lu FT24257666480054,200000
13/09/2024,TA DINH MINH chuyen tien (CT1111),200000
13/09/2024,Chuyen tien den tu NAPAS Noi dung: ZP242570101656 240913000195667 Hai Long dung Zalopay chuyen tien (CT1111),50000
13/09/2024,UNG HO DONG BAO THIEN TAI LU LUT (CT1111),1000000
13/09/2024,CT nhanh 247 den: MBVCB.7020234627.055008.Le Thu Hien ung ho dong bao bi bao lut do bao yagi.,300000
13/09/2024,con Nguyen Gia Bao sn 2023 ung ho dong bao lu lut (CT1111),100000
13/09/2024,CT nhanh 247 den: MaiNam Hai Phong cua it long nhieu gui moi nguoi vung lu,100000
13/09/2024,NGUYEN THI THUY HANG chuyen tien ung ho cuu tro thien tai mien bac,300000
13/09/2024,VY MINH TU chuyen tien ung ho dong bao mien bac (CT1111),50000
13/09/2024,CT nhanh 247 den: LE THANH TAN CHUYEN UNG HO BAO LUT (CT1111),2700000
13/09/2024,Chuyen tien den tu NAPAS Noi dung: Ho tro ba con dong bao bi anh huong boi lu,100000
13/09/2024,VU THI KIEU DUYEN Chuyen tien (CT1111),200000
13/09/2024,c minh; e huyen; e huong; e thuy quynh luu nghe an ung ho,1000000
13/09/2024,Chuyen tien den tu NAPAS Noi dung: DAO THI HONG NHUNG ung ho dong bao Vietnam va mong mn binh an FT24257382527498 (CT1111),100000
13/09/2024,CT nhanh 247 den: TRAN QUANG HAI chuyen tien . (CT1111),500000
13/09/2024,chuc ba con som vuot qua kho khan (CT1111),1000000
13/09/2024,Chuyen tien den tu NAPAS Noi dung: NGUYEN TAN LUC CHUYEN KHOAN- 130924-09:57:29 063089,5000
13/09/2024,Chuyen tien den tu NAPAS Noi dung: Nguyen Thi Thao Van chuyen tien,100000
13/09/2024,NGUYEN VAN DUONG Chuyen tien (CT1111),500000
13/09/2024,TRAN THI THUY chuyen tien ung ho ba con vung lu,100000
13/09/2024,ung ho mien bac do bao so 3 (CT1111),2000000
13/09/2024,Chuyen tien den tu NAPAS Noi dung: CHU THI NGOAN ung ho ba con (CT1111),200000
13/09/2024,CT nhanh 247 den: NGUYEN XUAN HONG ANH MONG MOI NGUOI SOM AN TOAN,1000000
13/09/2024,CT nhanh 247 den: NGO THI THANH THUY ung ho dong bao anh huong lu lut (CT1111),300000
13/09/2024,CT nhanh 247 den: LE KIM DUNG CHUYEN TIEN,100000
13/09/2024,CT nhanh 247 den: Vietinbank;111602391111;PHAM THI SUONG chuyen tien,50000
13/09/2024,999B2490KY1T1WK6/CTY TNHH TM VA DV HOANG YEN VIET NAM UNG HO DONG BAO BI THIET HAI DO BAO SO 3 (YAGI) GAY RA (CT1111),5000000
13/09/2024,MA THI THU HA chuyen tien ung ho dong bao bi thiet hai do con bao so 3 gay ra (CT1111),1000000
13/09/2024,CT nhanh 247 den: NGUYEN THI KIM THOA ung ho dong bao lu lut (CT1111),300000
13/09/2024,Chuyen tien den tu NAPAS Noi dung: Nguyen Thai Huy chuyen tien (CT1111),50000
13/09/2024,CT nhanh 247 den: MBVCB.7020241357.059040.Ung ho .,1200000
13/09/2024,Mien Bac co len,200000
13/09/2024,66715246636-0347054209-Xin dc gop it tam long gop phan khac phuc hau qua sau bao yagi,30000
13/09/2024,CT nhanh 247 den: Vietinbank;111602391111;co len,100000
13/09/2024,CT nhanh 247 den: MBVCB.7020248976.059648.NGUYEN TIEN DAT chuyen tien.,50000
13/09/2024,CT nhanh 247 den: LUU DUC LONG ung ho dong bao mua lu,50000
13/09/2024,Chuyen tien den tu NAPAS Noi dung: Ung ho ba con,200000
13/09/2024,Chuyen tien den tu NAPAS Noi dung: DINH THI THU HIEN ung ho dong bao lu lut mien bac FT24257498264905 (CT1111),200000
13/09/2024,NGUYEN HUY HOANG chuyen tien (CT1111),50000
13/09/2024,LY MY DINH ung ho dong bao bi thiet hai (CT1111),1000000
13/09/2024,Chuyen tien den tu NAPAS Noi dung: LylyKenHuongTung ung ho,500000
13/09/2024,be Truc An 4t mam non Nam Thanh Dien Bien ung ho dong bao vung lu (CT1111),200000
13/09/2024,CT nhanh 247 den: LAM TRUC LAM chuyen tien ung ho cuu tro ba con vung bao (CT1111),50000
13/09/2024,NGUYEN VAN TIEN ung ho bao so 3 (CT1111),200000
13/09/2024,CT nhanh 247 den: NGUYEN NHAT MINH chuyen tien . Chau la hoc sinh khong co nhieu a (CT1111),50000
13/09/2024,Chuyen tien den tu NAPAS Noi dung: Bui Cong Tan chuyen tien ung ho khac phuc hau qua con bao yagi (CT1111),500000
13/09/2024,Chuyen tien den tu NAPAS Noi dung: NGUYEN TRUNG ANH chuyen tien cuu tro dong bao mien Bac (CT1111),150000
13/09/2024,CT nhanh 247 den: MIEN BAC CO LEN,500000
13/09/2024,NGUYEN VAN MINH HOAN chuyen tien ung ho dong bao mien bac bi lu lut (CT1111),200000
13/09/2024,Chuyen tien den tu NAPAS Noi dung: Con la sinh vien mong gop duoc mot phan nho ho tro dong bao a (CT1111),20000
13/09/2024,NGUYEN THI HOAN ung ho ba con vung bao lu,300000
13/09/2024,CT nhanh 247 den: MBVCB.7020244567.063335.TRAN GIAN NHU HAO chuyen tien.,10000
13/09/2024,VU THI LAN ANH Chuyen tien,20000
13/09/2024,ung ho dong bao bi thiet hai yagi (CT1111),300000
13/09/2024,CHINH - BINH TIEN chuyen tien,400000
13/09/2024,Chuyen tien den tu NAPAS Noi dung: NGUYEN TRONG ANH chuyen khoan- 130924-09:58:39 064623,500000
13/09/2024,CT nhanh 247 den: MBVCB.7020252819.063878.DANG THI THUY NGAN .,1000000
13/09/2024,CT nhanh 247 den: MBVCB.7020255468.064544.cuu tro dong bao sau lu.,50000
13/09/2024,"Chuyen tien den tu NAPAS Noi dung: Gia dinh Bim xin gui chut tam long den ba con vung lu, mong ba con vuot qua kho khan",500000
13/09/2024,PHAN DUY TRUNG ung ho mien Bac (CT1111),200000
13/09/2024,Chuyen tien den tu NAPAS Noi dung: Ung ho mien bac FT24257429062900 (CT1111),200000
13/09/2024,CT nhanh 247 den: vu anh hoa (CT1111),50000
13/09/2024,Chuyen tien den tu NAPAS Noi dung: Hoa Lua Hong Duyen chuyen FT24257351628650 (CT1111),1000000
13/09/2024,CT nhanh 247 den: UNG HO CAC TINH PHIA BAC BI THIEN TAI LU LUT (CT1111),1000000
13/09/2024,CT nhanh 247 den: MY DUYEN CHUYEN TIEN UNG HO HO TRO BAO SO 3 (ct1111),300000
13/09/2024,PHAN THANH SON ung ho cuu tro bao Yagi,2000000
13/09/2024,DUONG THI DUYEN Chuyen tien UH dong bao mien bac (CT1111),200000
13/09/2024,Chuyen tien den tu NAPAS Noi dung: Ung ho sau bao so 3 FT24257083096363 (CT1111),200000
13/09/2024,DOAN THI MAI; em xin duoc gop 1 phan nho ung ho khac phuc bao Yagi,500000
13/09/2024,HOANG THANH SON ung ho dong bao khac phuc bao so 3 (CT1111),1000000
13/09/2024,ung ho dong bao vuot qua bao lu,100000
13/09/2024,Chuyen tien den tu NAPAS Noi dung: TRAN THI NGAN 0967522585 chia se noi dau mat mat cua ba con chiu anh huong dot bao lu vua qua FT24257614030013 (CT1111),1000000
13/09/2024,CT nhanh 247 den: Quay Thuoc Thai Binh ung ho lu lut (CT1111),100000
13/09/2024,TRAN VO CATHY chuyen tien (CT1111),200000
13/09/2024,Chau mong mien Bac som khac phuc duoc hau qua bao a Chau yeu mn,100000
13/09/2024,66715316976-0963677107-Ung ho dong bao mien Bac,50000
13/09/2024,Chuyen tien den tu NAPAS Noi dung: EM UNG HO DONG BAO ANH HUONG BOI CON BAO. MONG MOI NGUOI BINH AN- 130924-09:59:16 065493,100000
13/09/2024,DUONG THANH VAN chuyen tien,1000000
13/09/2024,BICH QUYEN xin dong gop cuu tro mien bac,200000
13/09/2024,Chuyen tien den tu NAPAS Noi dung: Chia se cung dong bao mien bac (CT1111),150000
13/09/2024,NGUYEN SY QUAN chuyen tien gop it tam long gui toi nguoi dan vung lu (CT1111),100000
13/09/2024,Chuyen tien den tu NAPAS Noi dung: NGUYEN THI MINH TRANG chuyen tien tu Viettel Money (CT1111),500000
13/09/2024,CT nhanh 247 den: MBVCB.7020258812.068710.MIEN NAM GUI MIEN BAC THAN YEU.,200000
13/09/2024,chuyen tien ung ho dong bao bao lu (CT1111),100000
13/09/2024,66715429843-0987701923-PHAN THI DUONG THUY chuyen tien ung ho dong bao mong mn se an toan,100000
13/09/2024,chung tay ung ho dong bao bi bao lut mien Bac,500000
13/09/2024,CT nhanh 247 den: LE THI THU TRANG CHUYEN TIEN UNG HO DONG BAO BI BAO LU (ct1111),200000
13/09/2024,NGUYEN DINH DUONG . viet nam doan ket; doan ket; dai doan ket (CT1111),100000
13/09/2024,chau quach huukhoi nguyen ung ho dong bao (CT1111),1000000
13/09/2024,chau cung chi con mot chut tien trong tk thoi nhung van muon gui den moi nguoi a (CT1111),50000
13/09/2024,con xin ung ho chut tam long den dong bao mb (CT1111),50000
13/09/2024,CT nhanh 247 den: NGUYEN THI MINH HANG chuyen tien (CT1111),23987
13/09/2024,VU QUOC ANH chuyen tien ung ho dong bao bi lu lut (CT1111),100000
13/09/2024,CT nhanh 247 den: Vietinbank;111602391111;PK CAM THI XUAN TK3 TT Phu Yen Son La chuyen tien ung ho dong bao bi anh huong bao so 3 Yagi,1000000
13/09/2024,Chuyen tien den tu NAPAS Noi dung: NGUYEN MANH DAM chuyen tien FT24257119604170,1000000
13/09/2024,HA LAN-Co Mieu-xa Phat Tich-Tien Du-Bac Ninh ung ho (CT1111),500000
13/09/2024,ung ho dong bao mien bac (CT1111),5000000
13/09/2024,CT nhanh 247 den: THUONG DONG BAO (CT1111),200000
13/09/2024,DO HAI YEN Chuyen tien (CT1111),200000
13/09/2024,Chuyen tien den tu NAPAS Noi dung: Pham Hong Son chuyen tien cuu tro dong bao,100000
13/09/2024,CT nhanh 247 den: MAI THI PHUOC HOAI chuyen tien,70390
13/09/2024,ung ho bao lu (CT1111),200000
13/09/2024,Chuyen tien den tu NAPAS Noi dung: VI DONG BAO MIEN NUI PHIA BAC-130924- 10:00:08 066695,200000
13/09/2024,Chuyen tien den tu NAPAS Noi dung: Ung ho dong bao mien bac FT24257692874092 (CT1111),50000
13/09/2024,CT nhanh 247 den: MBVCB.7020262032.072846.LE HOANG HUONG GIANG ung ho ba con mien bac .,200000
13/09/2024,LE NHAT SON chau la sinh vien; khong co nhieu nhung mong dong bao vuot qua kho khan a,50000
13/09/2024,CT nhanh 247 den: khanhly fan HieuThuHai ung ho dong bao (CT1111),100000
13/09/2024,NHAN DAN DONG LONG- VIET NAM QUYET THANG (CT1111),100000
13/09/2024,CT nhanh 247 den: NGUYEN CHINH CHUYEN TIEN (CT1111),100000
13/09/2024,999B2490KY5AT76J/GIFT/CHARITY/DONA TION DBSSSGSGXXX DBS BANK LTD (CT1111),10000000
13/09/2024,999B2490KY5ATYT5/GIFT/CHARITY/DON ATION DBSSSGSGXXX DBS BANK LTD (CT1111),185185
13/09/2024,66715434833-0775291721-Ung ho dong bao lu lut,50000
13/09/2024,CT nhanh 247 den: LE THI HONG NHUNG ung ho dong bao mien bac,100000
13/09/2024,Chi bo CaoHung Dai Loan ung ho dong bao mien bac (CT1111),2000000
13/09/2024,PHAM THE HUNG chuyen tien ung ho (CT1111),1000000
13/09/2024,Chuyen tien den tu NAPAS Noi dung: Uh dong bao khac phuc bao Yagi (CT1111),200000
13/09/2024,TANG UYEN LINH chuyen tien ung ho lu lut,500000
13/09/2024,CT nhanh 247 den: CHIA SE TOI DONG BAO MIEN BAC MUA LU (CT1111),500000
13/09/2024,Chuyen tien den tu NAPAS Noi dung: Thuong gui dong bao mien Bac,200000
13/09/2024,NGUYEN XUAN NGAI chuyen tien ung ho dong bao bao lu (CT1111),300000
13/09/2024,CT nhanh 247 den: Vietinbank;ct1111;HA THI BAC chuyen tien ung ho (ct1111),100000
13/09/2024,CT nhanh 247 den: PHAM TRAN KHOI NGUYEN chuyen tien ung ho cuu tro bao so 3 (CT1111),200000
13/09/2024,Vo chong Hanh Huong ung ho dong y dong bao lu lut,500000
13/09/2024,"Chuyen tien den tu NAPAS Noi dung: Ung ho dong bao bi lu lut, mong dong bao mau chong vuot qua kho khan nay",50000
13/09/2024,Chan Thanh Chia Se.,500000
13/09/2024,66715090786-0334271554-Ung ho dong bao mien Bac,300000
13/09/2024,HOANG THI THANH Chuyen tien (CT1111),100000
13/09/2024,ung ho dong bao lu lut cua it long nhiu mong moi nguoi deu binh an khoe manh (CT1111),200000
13/09/2024,UNG HO THIEN TAI MIEN BAC,1000000
13/09/2024,Chuyen tien den tu NAPAS Noi dung: Hoc sinh cuu tro dong bao (CT1111),8514
13/09/2024,CT nhanh 247 den: Chau Nguyen Anh Duong ung ho nguoi dan vung lu lut (CT1111),1000000
13/09/2024,VU HAI TIEN chuyen tien,4280
13/09/2024,CT nhanh 247 den: Quyen gop ung ho khac phuc hau qua bao Yagi (CT1111),100000
13/09/2024,DANG THANH PHONG Chuyen tien,20000
13/09/2024,CT nhanh 247 den: CON UNG HO CAC TINH BI BAO LU A.,1000000
13/09/2024,NGUYEN THI NGOC YEN chuyen tien ho tro dong bao khac phuc bao lu (CT1111),1100000
13/09/2024,Chuyen tien den tu NAPAS Noi dung: LE HONG DUC chuyen FT24257508192020 (CT1111),2000000
13/09/2024,NGUYEN ANH KIET NPACKR Chuyen tien (CT1111),150000
13/09/2024,CT nhanh 247 den: TRAN QUY UNG HO (ct1111),500000
13/09/2024,DAO THI MAI NHUNG ung ho dong bao bi thiet hai do con bao so 3,200000
13/09/2024,CT nhanh 247 den: TRAN THUY DIEN CHAU LA DU HOC SINH O XA TAI KHOAN CHAU KHONG CON NHIEU MONG MOI NGUOI SOM VUOT QUA KHO KHAN A (CT1111),30000
13/09/2024,NGUYEN THI NHU Y cuu tro bao Yagi mien Bac (CT1111),100000
13/09/2024,CT nhanh 247 den: NGUYEN THANH HA THAI BINH UNG HO DONG BAO VUNG LU (CT1111),1000000
13/09/2024,GD Ngoc My.Ung ho bao Yagi.VietNam doan ket muon doi,7000000
13/09/2024,Chuyen tien den tu NAPAS Noi dung: BUI MINH TAM chuyen tien FT24257265238316,200000
13/09/2024,NGUYEN NHU SON chuyen tien ung ho ba con mien Bac (CT1111),500000
13/09/2024,CT nhanh 247 den: MBVCB.7020287469.080833.TRAN THI LE THUY chuyen tien.,100000
13/09/2024,CT nhanh 247 den: Ung ho khac phuc sau thien tai (CT1111),1000000
13/09/2024,CT nhanh 247 den: UNG HO DONG BAO KHAC PHUC SAU CON BAO YAGI,200000
13/09/2024,Chuyen tien den tu NAPAS Noi dung: em SV mong gop it suc nho cho ba con mien Bac FT24257717341485,58689
13/09/2024,CT nhanh 247 den: PHAM NGO HIEN MAI chuyen tien (CT1111),97000
13/09/2024,chut tam long nho cua con mong dong bao duoc binh an (CT1111),300000
13/09/2024,CBCNV CONG TY TNHH NGOC HUNG UNG BO DONG BAO LU LUT,4000000
13/09/2024,CT nhanh 247 den: MOT CHUT TAM LONG UNG HO BA CON KHAC PHUC BAO YAGI,100000
13/09/2024,CONG TY TNHH SX THANH DONG THUONG TIN TP HA NOI DUNG HO DONG BAO LU LUT CON BAO SO 3 YAGI,3000000
13/09/2024,CT nhanh 247 den: Chau la tan sinh vien nen khong co nhieu tien huhu. Cua it long nhieu day la so tien it oi chau co the dong gop duoc. Mong rang dat nuoc ta se som vuot qua duoc tran bao lich su nay. (CT1111),25000
13/09/2024,Ung ho dong bao bao lu mong moi nguoi deu binh an (CT1111),100000
13/09/2024,CT nhanh 247 den: Gia dinh Nguyen Hoang Minh Khang Mo Lao Ha Dong Ha Noi Ung ho dong bao bi thien tai bao va lu lut (CT1111),1000000
13/09/2024,Chuyen tien den tu NAPAS Noi dung: KIEU THI THU TRANG ung ho dong bao lu lut FT24257563469471,100000
13/09/2024,NGUYEN THI THU HONG chuyen tien (CT1111),500000
13/09/2024,vu hai phong thon 6 quang tin dak nong ung ho bao YAGI (CT1111),200000
13/09/2024,CT nhanh 247 den: HUYNH THI MY XUYEN chuyen tien,500000
13/09/2024,Chuyen tien den tu NAPAS Noi dung: VO THI TUYEN CHUYEN KHOAN cua it long nhieu ung ho mien Bac ruot thit (CT1111),50000
13/09/2024,THACH THI VUI chuyen tien (CT1111),200000
13/09/2024,Ung ho dong bao,100000
13/09/2024,tran thi le trinh chung tay Huong ve Mien Bac (CT1111),1000000
13/09/2024,CT nhanh 247 den: TRAN NGOC NGAN 225835 DH22XET04 0375807089 UNG HO DONG BAO BI THIET HA DO CON BAO SO 3 GAY RA (CT1111),100000
13/09/2024,gd men hung ung ho dong bao lu lut mien bac,200000
13/09/2024,CT nhanh 247 den: Vietinbank;CT1111;kdkpopshop - Nguoi ham mo BTS tai Viet Nam ung ho dong bao khac phuc hau qua bao so 3 (CT1111),1306000
13/09/2024,Chuyen tien den tu NAPAS Noi dung: mong moi nguoi dc binh an (CT1111),200000
13/09/2024,CT nhanh 247 den: Vietinbank;ct1111;HUYNH VAN MUOI HAI chuyen tien (ct1111),500000
13/09/2024,NGUYEN THI MY HANH cau nguyen mien bac binh an,100000
13/09/2024,NGUYEN THI SAM thon ha duong ha gia lam ha noi ung ho dong bao lu lut (CT1111),200000
13/09/2024,Chuyen tien den tu NAPAS Noi dung: NGUYEN MANH SY chuyen tien FT24257658610402,200000
13/09/2024,CT nhanh 247 den: CLB tinh nguyen truong THPT CBQGL ung ho dong bao vung bao lu,100000
13/09/2024,ung ho dong bao bao lu,10000
13/09/2024,VU QUANG MINH ung ho thiet hai bao so 3,500000
13/09/2024,NT Xuan Ho tro nan nhan bao lu. Chuc moi nguoi binh an manh khoe (CT1111),1500000
13/09/2024,CT nhanh 247 den: HA THI HONG chuyen tien (CT1111),2100000
13/09/2024,Ung ho cuu tro bao so yagi (CT1111),1000000
13/09/2024,Chuyen tien den tu NAPAS Noi dung: TRAN DUC NHIEN ung ho dong bao FT24257992357050 (CT1111),500000
13/09/2024,Chuyen tien den tu NAPAS Noi dung: Nguyen Thi Hai Yen chuyen tien tu TNEX (CT1111),20003
13/09/2024,Chuyen tien den tu NAPAS Noi dung: CHUT TAM LONG CUA CON UNG HO BA CON KHAC PHUC HAU QUA-130924- 10:02:21 069596 (ct1111),100000
13/09/2024,CT nhanh 247 den: chau xin dong gop ho tro dong bao vung lu vi con dang di hoc nen chau khong co nhieu,10000
13/09/2024,DINH NGOC KIEN chuyen tien,500000
13/09/2024,CT nhanh 247 den: Con xin gop chut cong suc cua minh de giup do dong bao minh vuot qua kho khan cua con bao a,100000
13/09/2024,ung ho dong bao lu lut,200000
13/09/2024,LAM THI BICH TUYEN ung ho dong bao khac phuc bao yagi,500000
13/09/2024,CT nhanh 247 den: em la sinh vien nen chi giup duoc it mong gop duoc 1 phan cho moi nguoi a,20000
13/09/2024,Khoa YHCT-PHCN Trung tam Y te Quan 8 gui chut tam long den Mien Bac khac phuc hau qua sau bao so 3 (CT1111),500000
13/09/2024,HUYNH VAN VU MIEN NAM,300000
13/09/2024,Chuyen tien den tu NAPAS Noi dung: IBFT TRAN THI MINH THU chuyen tien (CT1111),200000
13/09/2024,CT nhanh 247 den: CAO PHUONG THAO CHUYEN TIEN,50000
13/09/2024,Toi khong co nhieu. Mong Dong Bao mien Bac vuot qua kho khan mua bao lu nay. Chuc Dong Bao binh an. (CT1111),20000
13/09/2024,NGUYEN VAN PHUONG Chuyen tien ung ho lut (CT1111),500000
13/09/2024,Chuyen tien den tu NAPAS Noi dung: Gia dinh Thai Linh Mint ung ho cau mong moi nguoi binh an,500000
13/09/2024,TRAN THI NGOC HANG chuyen tien ung ho lu lut,500000
13/09/2024,NGO THI THU QUYNH ct ung ho dong bao vung lu lut (CT1111),300000
13/09/2024,Chuyen tien den tu NAPAS Noi dung: VU NGUYEN PHUONG TRANG UNG HO BAO LUT FT24257279132700 (CT1111),200000
13/09/2024,ung ho cuu tro dong bao mien bac,200000
13/09/2024,ung ho (CT1111),25000
13/09/2024,CT nhanh 247 den: DO THANH GIANG chuyen tien (CT1111),100000
13/09/2024,NGUYEN THI THANH THAO mong ba con vuot qua kho khan,100000
13/09/2024,TRAN HUU SANG chuyen tien cuu tro dong bao bao lu (CT1111),100000
13/09/2024,Chuyen tien den tu NAPAS Noi dung: NGUYEN THI PHUONG ANH chuyen tien (CT1111),10000
13/09/2024,Chuyen tien den tu NAPAS Noi dung: MAI TRUNG KHOA CHUYEN KHOAN HO TRO MIEN BAC-130924-10:02:54 070294,200000
13/09/2024,VU HAI DANG Chuyen tien ung ho,200000
13/09/2024,CT nhanh 247 den: MBVCB.7020296217.090272.Mong dong bao mien Bac som on dinh. Thuongasc(33).,50000
13/09/2024,CT nhanh 247 den: Vietinbank;CT1111;TRAN HUY CHUYEN chuyen tien ung ho dong bao cac Tinh TP bi thiet hai do con bao so 3 YAGI (CT1111),300000
13/09/2024,Chuyen tien den tu NAPAS Noi dung: IBFT Mien Bac som quay lai ve dep von co cua minh nhe (CT1111),32238
13/09/2024,NGUYEN THANH DAT Chuyen tien ung ho ba con mien Bac,200000
13/09/2024,CT nhanh 247 den: Vietinbank;ct1111;VAN THE TUAN chuyen tien (ct1111),100000
13/09/2024,Chuyen tien den tu NAPAS Noi dung: Loc Thi Khanh Ly chuyen tien ung ho dia phuong anh huong con bao Yagi (Ct1111),100000
13/09/2024,NGUYEN THI LANH chuyen tien (CT1111),500000
13/09/2024,Gia dinh PHAM DUNG SY cuu tro dong bao anh huong bao so 3,2000000
13/09/2024,NGUYEN THI NGOC HUYEN ung ho bao so 3 mien Bac (CT1111),100000
13/09/2024,BUI TRUNG HIEU chuyen tien Ung ho dong bao bao lut thien tai (CT1111),300000
13/09/2024,Chuyen tien den tu NAPAS Noi dung: TRAN HUY HIEP chuyen FT24257590302090 (CT1111),500000
13/09/2024,CT nhanh 247 den: MBVCB.7020298476.093028.TRAN THI NGOC TRAM chuyen tien ung ho lu lut.,300000
13/09/2024,Chuyen tien den tu NAPAS Noi dung: Mong ca nuoc minh binh an. Chau yeu To Quoc minh vo cung,50000
13/09/2024,Chuyen tien den tu NAPAS Noi dung: IBFT Nhom Alone 4 mua ung ho dong bao lu lut (CT1111),1289000
13/09/2024,VAN PHU NAM chuyen tien ung ho vung lu (CT1111),500000
13/09/2024,Chuyen tien den tu NAPAS Noi dung: DANG DUY KHANH chuyen ung ho dong bao bao yagi FT24257530087392 (CT1111),340000
13/09/2024,CT nhanh 247 den: MBVCB.7020309533.094387.ngocduyen.,200000
13/09/2024,chau Khanh Ngoc ung ho dong bao lu lut (CT1111),90000
13/09/2024,CT nhanh 247 den: Vietinbank;CT1111;Ung ho dong bao bi thiet hai do bao so 3 gay ra (CT1111),200000
13/09/2024,Chuyen tien den tu NAPAS Noi dung: IBFT PHAM CONG TU ung ho dong bao lu lut (CT1111),700000
13/09/2024,Chuyen tien den tu NAPAS Noi dung: Phan Trinh Gui ung ho dong bao bi thiet hai do con bao so 3 gay ra (CT1111),300000
13/09/2024,CT nhanh 247 den: MBVCB.7020293298.087341.NGUYEN THI VAN chuyen tien.,200000
13/09/2024,CT nhanh 247 den: Vietinbank;CT1111;HA VIET BINH AN chuyen tien cuu tro vung lu (CT1111),20000
13/09/2024,CT nhanh 247 den: MBVCB.7020310075.095013.Vncsgo cho doi xin gop suc khac phuc bao lu .,5000000
