date,content,money
13/09/2024,CT nhanh 247 den: Vietinbank;ct1111;PHAM THI XUAN chuyen tien (ct1111),1000000
13/09/2024,Chuyen tien den tu NAPAS Noi dung: MIEN NAM GUI MIEN BAC NHUNG YEU THUONG-130924-08:21:35 943582,1000000
13/09/2024,NGUYEN THI HONG BICH Chuyen tien ung ho lu lut (CT1111),2000000
13/09/2024,CT nhanh 247 den: NGUYEN THI RANH chuyen tien ho tro dong bao mien bac khac phuc sau bao (CT1111),200000
13/09/2024,"Chuyen tien den tu NAPAS Noi dung: LE VAN BAC ung ho dong bao lu lut, thien tai FT24257318193562 (CT1111)",500000
13/09/2024,Chuyen tien den tu NAPAS Noi dung: Yeu thuong FT24257095706281 (CT1111),1000000
13/09/2024,Chuyen tien den tu NAPAS Noi dung: UNG HO BAO LU MIEN BAC-130924-08:21:46 943754,200000
13/09/2024,CT nhanh 247 den: PHAM HOAI TRUNG CHUYEN TIEN (ct1111),400000
13/09/2024,Chuyen tien den tu NAPAS Noi dung: Ung ho khac phuc bao so 3,100000
13/09/2024,CT nhanh 247 den: LU GIA QUOC TUAN chuyen tien (CT1111),100000
13/09/2024,ung ho dong bao bao lu (CT1111),200000
13/09/2024,LE VAN TRUNG KIEN Chuyen tien giup do dong bao thiet hai bao so 3 (CT1111),1000000
13/09/2024,CT nhanh 247 den: LAI THI NGOC HUYEN chuyen tien (CT1111),150000
13/09/2024,TRAN THI PHUONG truc thuan truc ninh nam dinh ung ho dong bao,200000
13/09/2024,Chuyen tien den tu NAPAS Noi dung: CAO VAN CHIEN chuyen tien ung ho dong bao sau con bao so 3 FT24257665321540 (CT1111),500000
13/09/2024,CT nhanh 247 den: HONG HUY VA EM HAI EN NE CO LEN NHE DONG BAO VUNG LU LUT,200000
13/09/2024,CT nhanh 247 den: TRAN MAI Phuong ung ho dong bao lu lut (CT1111),1000000
13/09/2024,Me NHI va em Q.Khanh gui tang Dong Bao (CT1111),500000
13/09/2024,Chuc cho dong bao minh tai qua nan khoi (CT1111),100000
13/09/2024,Chuyen tien den tu NAPAS Noi dung: Ung ho lu lut,500000
13/09/2024,CT nhanh 247 den: MBVCB.7019349871.517418.NGUYEN THI HAN rikkei chuyen tien ung ho lu.,100000
13/09/2024,Chuyen tien den tu NAPAS Noi dung: PHAM THI THU THUY chuyen tien FT24257709254413,100000
13/09/2024,VU THI LIEU ung ho dong bao bao lu (CT1111),1000000
13/09/2024,Gia dinh Phong - Ngoc Anh ung ho (CT1111),300000
13/09/2024,CT nhanh 247 den: BUI MINH ANH chuyen tien (CT1111),20000
13/09/2024,Chuyen tien den tu NAPAS Noi dung: Chau xin ung ho chut it cho dong bao lu lut trong con bao so 3 vua qua. (CT1111),216432
13/09/2024,TRAN NGOC KY DUYEN chuyen tien,100000
13/09/2024,HUYNH QUOC TUAN Chuyen tien ung ho vung lu;sat lo mien Bac (CT1111),100000
13/09/2024,THAI MINH NHAT chuyen tien (CT1111),100000
13/09/2024,Chuyen tien den tu NAPAS Noi dung: CAO NGOC THE chuyen tien (ct1111),200000
13/09/2024,Chuyen tien den tu NAPAS Noi dung: VO DUY TUAN chuyen FT24257996145600 (CT1111),500000
13/09/2024,NGUYEN HOA NGOC ANH chuyen tien mong moi nguoi binh an (CT1111),200000
13/09/2024,CT nhanh 247 den: MBVCB.7019351341.519441.Thuong Ly ung ho mien bac bao so 3.,200000
13/09/2024,CT nhanh 247 den: Vietinbank;111602391111;DO THUY NGOC NU chuyen tien xin ho tro it tien gui Mien Bac khac phuc hau qua bao lu,200000
13/09/2024,CT nhanh 247 den: Con la Truong Tuan Anh sinh vien truong Dai Hoc Cong Nghiep Ha Noi. Chung tay ung ho dong bao gap lu lut.,500000
13/09/2024,Chuyen tien den tu NAPAS Noi dung: DUONG LE TAN VINH chuyen tien FT24257452610565,10000
13/09/2024,Chuyen tien den tu NAPAS Noi dung: ung ho dong bao bi anh huong bao lu (CT1111),200000
13/09/2024,Chuyen tien den tu NAPAS Noi dung: ZP242570069987 240913000140206 Nguyen Ngoc Tam dung Zalopay chuyen tien (Ct1111),500000
13/09/2024,Chuyen tien den tu NAPAS Noi dung: UNG HO DONG BAO VUNG LU-130924- 08:22:53 944918,500000
13/09/2024,CT nhanh 247 den: GIA DINH DUONG HAU XIN DUOC DONG GOP VA KHAC PHUC HAU QUA DO BAO YAGI GAY RA.,300000
13/09/2024,CT nhanh 247 den: Vietinbank;CT1111;Con mong co the giup mot chut suc cho moi nguoi a. (CT1111),45500
13/09/2024,Chuyen tien den tu NAPAS Noi dung: Candice Tran ho tro thien tai Yagi (ct1111),1000000
13/09/2024,CT nhanh 247 den: MBVCB.7019361005.521251.HA THI THUY NGUYEN UNG HO BAO YAGI.,500000
13/09/2024,mot chut tam long ho tro mien bac vuot qua kho khan (CT1111),500000
13/09/2024,CT nhanh 247 den: p1007 A2 Nguyen Co Thach ung ho nhan dan (CT1111),500000
13/09/2024,Chuyen tien den tu NAPAS Noi dung: BUI THUY LINH UH DONG BAO BI BAO LU FT24257803587654 (CT1111),300000
13/09/2024,Chuyen tien den tu NAPAS Noi dung: UNG HO DB MB-130924-08:23:19 945332 (CT1111),100000
13/09/2024,Chuyen tien den tu NAPAS Noi dung: NGO VAN LAN UNG HO DONG BAO LU LUT FT24257410827307,1000000
13/09/2024,CT nhanh 247 den: Vietinbank;CT1111;Truong My Thuy Giang ung ho ba con vung bao lu so 3 (CT1111),400000
13/09/2024,CT nhanh 247 den: DO THANH LONG CHUYEN TIEN (CT1111),30000
13/09/2024,Chuyen tien den tu NAPAS Noi dung: Gia dinh Tao Viet Hung ung ho dong bao bi thiet hai do bao lu,1000000
13/09/2024,CT nhanh 247 den: DINH THI NGA chuyen tien ung ho dong bao lu lut,2000000
13/09/2024,TRAN THI MONG KIEU chuyen tien ung ho dong bao,100000
13/09/2024,CT nhanh 247 den: Vietinbank;CT1111;NGUYEN THI DUY chuyen tien ung bao lut mien bac (CT1111),500000
13/09/2024,PHAM VAN TIEN Chia se voi dong bao bao lu,100000
13/09/2024,HPH ung ho dong bao Mien Bac (CT1111),200000
13/09/2024,Chuyen tien den tu NAPAS Noi dung: To thuoi Tuoi tho - QTL46A - ULAW gui dong bao bi thiet hai do bao (CT1111),622000
13/09/2024,DO THI HAI VAN chuyen tien ung ho dong bao (CT1111),50000
13/09/2024,Chuyen tien den tu NAPAS Noi dung: UNG HO DONG BAO MIEN BAC-130924- 08:23:30 945565 (CT1111),50000
13/09/2024,CT nhanh 247 den: NGUYEN THI THUY LOAN ung ho dong bao mien bac bi anh huong boi bao Yagi (CT1111),50000
13/09/2024,NGUYEN THAC TIEN chuyen tien (CT1111),500000
13/09/2024,CT nhanh 247 den: NGUYEN VAN MINH ung ho mien bac (CT1111),100000
13/09/2024,Dac San Tay Nguyen Oanh Sam chung tay cung mien bac,1000000
13/09/2024,DUONG QUOC DANG chuyen tien (CT1111),50000
13/09/2024,ung ho dong bao bi thiet hai do con bao so 3 gay ra (CT1111),1000000
13/09/2024,NGUYEN HONG SON ung ho dong bao lu lut (CT1111),200000
13/09/2024,ung ho Mien Bac than yeu,200000
13/09/2024,CT nhanh 247 den: MBVCB.7019356454.516123.ung ho dong bao mien Bac vuot qua kho khan .,1000000
13/09/2024,Chuyen tien den tu NAPAS Noi dung: vo chong phong mai ung ho dong bao vung lu bao Yagi (ct1111),500000
13/09/2024,Chuyen tien den tu NAPAS Noi dung: Ung ho dong bao bao lu FT24257705182296,1000000
13/09/2024,CT nhanh 247 den: NGUYEN HA MY ung ho ba con vung lu lut (CT1111),10004
13/09/2024,CT nhanh 247 den: Vietinbank;CT1111;TRAN THI THAO ung ho (CT1111),200000
13/09/2024,Chuyen tien den tu NAPAS Noi dung: DO THI HANG ung ho dong bao chiu thiet hai do bao lu. FT24257563293850 (CT1111),100000
13/09/2024,Chuyen tien den tu NAPAS Noi dung: Nguyen Thi Anh chuyen tien,100000
13/09/2024,NGUYEN THI HONG chuyen tien,300000
13/09/2024,NGUYEN VIET QUAN chuyen tien (CT1111),1000000
13/09/2024,Chuyen tien den tu NAPAS Noi dung: Ung ho dong bao bi thien tai (Ct1111),200000
13/09/2024,Chuyen tien den tu NAPAS Noi dung: YEN KHANG UNG HO DONG BAO LU YAGI CHUC MN BINH AN KHOE MANH A- 130924-08:24:09 946224 (CT1111),100000
13/09/2024,CT nhanh 247 den: NGUYEN VAN DUC ung ho dong bao do thiet hai cua bao yagi va lu quet (CT1111),20000
13/09/2024,Ung ho dong bao lu lut mien bac,250000
13/09/2024,TRAN THI HANH chuyen tien ung ho cuu tro lu lut (CT1111),200000
13/09/2024,"Chuyen tien den tu NAPAS Noi dung: NGUYEN THI VAN chuyen tien ung ho cuu tro mien bac do anh huong bao, lu lut FT24257685143253 (CT1111)",100000
13/09/2024,TRAN THI THOA Chuyen tien,2000000
13/09/2024,Chuyen tien den tu NAPAS Noi dung: chuyen khoan ung ho vung bao (CT1111),4147
13/09/2024,66708582615-0939773213-hi vong se giup ba con vung lu,50000
13/09/2024,Chuyen tien den tu NAPAS Noi dung: Ung ho lu lut mien Bac (CT1111),200000
13/09/2024,CT nhanh 247 den: MONG BINH AN DEN VOI VN YEU DAU (CT1111),200000
13/09/2024,CT nhanh 247 den: DO VAN QUYET BV PHU SAN HA NOI,1000000
13/09/2024,Chuyen tien den tu NAPAS Noi dung: Nguyen Lam chuyen tien ung ho khac phuc hau qua bao so 3,500000
13/09/2024,NGUYEN NGOC TOAN chuyen tien,300000
13/09/2024,Chuyen tien den tu NAPAS Noi dung: Cty Thach An ung ho ba con thiet hai bao so 3 FT24257095707964,3000000
13/09/2024,CT nhanh 247 den: MBVCB.7019368491.528703.Ung ho Dong bao lu lut.,1000000
13/09/2024,HUYNH MANH TUAN chuyen tien (CT1111),500000
13/09/2024,CT nhanh 247 den: Vietinbank;CT1111;NGUYEN THI THU HA ung ho dong bao vuot qua kho khan sau con bao so 3 (CT1111),100000
13/09/2024,DAO THI NHUNG Chuyen tien ung ho dong bao khac phuc sau bao so 3 (CT1111),500000
13/09/2024,CT nhanh 247 den: NGUYEN THI NHUNG chuyen tien (CT1111),300000
13/09/2024,CT nhanh 247 den: MAI TRAN THANH HOANG chuyen tien cuu tro dong bao bi Thien tai,1000000
13/09/2024,Chuyen tien den tu NAPAS Noi dung: gd ai phuong long thanh ung ho ba con bi lu lut FT24257620904901 (CT1111),1000000
13/09/2024,CT nhanh 247 den: MBVCB.7019377825.529261.NGUYEN THI KIM DUNG chuyen tien ung ho dong bao bao lu.,300000
13/09/2024,Chuyen tien den tu NAPAS Noi dung: TRINH XUAN HIEU chuyen ung ho dong bao chiu anh huong bao FT24257751888020 (CT1111),50000
13/09/2024,LE VU THUY MY Chuyen tien ung ho (CT1111),300000
13/09/2024,Ung ho dong bao (CT1111),100000
13/09/2024,Chuyen tien den tu NAPAS Noi dung: LUONG THI NGOC DUNG ung ho dong bao bi lu lut mien Bac FT24257023632135 (CT1111),200000
13/09/2024,CT nhanh 247 den: Nguyen Xuan Quang A9.18P2 CcSGAVN TP.Thu Duc Ung ho cac tinh bi bao lu mien Bac. (CT1111),500000
13/09/2024,CT nhanh 247 den: BUI TRUNG THANH ung ho dong bao khac phuc hau qua,555555
13/09/2024,Chuyen tien den tu NAPAS Noi dung: Noi That Ngoc Anh ung ho dong bao thiet hai do lu lut (CT1111),3000000
13/09/2024,NGUYEN VAN BAO chuyen tien uh ba con vung lu (CT1111),100000
13/09/2024,CT nhanh 247 den: NGUYEN TRONG PHONG chuyen tien ung ho ba con anh huong bao lu.,500000
13/09/2024,Chuyen tien den tu NAPAS Noi dung: Be Nguyen Kieu Diep Anh ung ho khac phuc hau qua bao yagi mien Bac (CT1111),100000
13/09/2024,Chuyen tien den tu NAPAS Noi dung: Nguyen Hoang Trung ung ho dong bao bao lut (CT1111),100000
13/09/2024,Chuyen tien den tu NAPAS Noi dung: NGUYEN THI HOAI NAM CHUYEN KHOAN BAN VAN DONG CUU TRO TRUNG UONG,500000
13/09/2024,NGUYEN TOAN HUNG chuyen tien ung ho dong bao lu lut (CT1111),1000000
13/09/2024,Chuyen tien den tu NAPAS Noi dung: mong co the ho tro moi nguoi mot chut aaaa (CT1111),13000
13/09/2024,VU THI TUYEN QUY TIN DUNG ND SONG MAI UNG HO DONG BAO LU LUT MB,200000
13/09/2024,Chuyen tien den tu NAPAS Noi dung: Phuong Trang ung ho mien Bac (CT1111),100000
13/09/2024,Chuyen tien den tu NAPAS Noi dung: MAI DUC ANH chuyen ung ho thiet hai do bao so 3 gay ra FT24257613784610 (CT1111),50000
13/09/2024,NGUYEN NGOC TIEN chuyen tien (CT1111),50000
13/09/2024,BUI THANH TUAN Chuyen tien ung ho dong bao bi anh huong lu lut (CT1111),300000
13/09/2024,CT nhanh 247 den: MBVCB.7019376437.527500.DOAN ANH TUAN chuyen tien . ung ho dong bao lu lut mien bac..,200000
13/09/2024,"Chuyen tien den tu NAPAS Noi dung: Ung ho MIEN BAC , ma GD 249462732",30000
13/09/2024,Chuyen tien den tu NAPAS Noi dung: IBFT Ung ho dong bao vuot bao Yagi,500000
13/09/2024,CT nhanh 247 den: NGUYEN VAN SON chuyen tien,100000
13/09/2024,Con day Tieng Anh cho cac be o Da Ton Gia Lam co chut tam long co tro con ung ho dong bao a (CT1111),400000
13/09/2024,chung tay cuu tro mien Bac,200000
13/09/2024,Chuyen tien den tu NAPAS Noi dung: UNG HO DONG BAO BAO LUT-130924- 08:25:27 947580 (CT1111),2000000
13/09/2024,CT nhanh 247 den: MBVCB.7019381844.534107.NGUYEN THI KIM NHAN chuyen tien.,100000
13/09/2024,Chuyen tien den tu NAPAS Noi dung: PHAM THI PHUONG THANH chuyen FT24257410836138 (CT1111),100000
13/09/2024,Chuyen tien den tu NAPAS Noi dung: PHAN THI THU TRANG chuyen tien FT24257966677023,100000
13/09/2024,CT nhanh 247 den: MBVCB.7019373255.534426.NGUYEN THI THAO chuyen tien.,100000
13/09/2024,Yangbuffsao ung ho mien Bac (CT1111),100000
13/09/2024,Gop chut suc nho ho tro ba con ngoai bac (CT1111),50000
13/09/2024,Chuyen tien den tu NAPAS Noi dung: Gop phan cuu tro dong bao mien bac (CT1111),2000000
13/09/2024,VO QUOC CONG chuyen tien,300000
13/09/2024,CT nhanh 247 den: Vietinbank;CT1111;NGUYEN THACH LOAN chuyen tien (CT1111),500000
13/09/2024,DANG NGOC THU ung ho dong bao lu lut (CT1111),1000000
13/09/2024,CT nhanh 247 den: TO PHUONG UYEN CHUYEN TIEN UNG HO DONG BAO BI THIET HAI DO CON BAO SO 3 GAY RA (CT1111),200000
13/09/2024,HO NHUT AN Chuyen tien,100000
13/09/2024,Chuyen tien den tu NAPAS Noi dung: IBFT Lam Phat ck cuu tro (ct1111),50000
13/09/2024,CT nhanh 247 den: Vietinbank;CT1111;NGUYEN THI THANH TAM chuyen tien (CT1111),100000
13/09/2024,ho tro nan nhan bao Yagi (CT1111),300000
13/09/2024,DANG HONG TRUNG chuyen tien ung ho dong bao (CT1111),200000
13/09/2024,DOAN THI LY chuyen tien tien cuu tro mien bac do bao yagi (CT1111),500000
13/09/2024,Chuyen tien den tu NAPAS Noi dung: TON THAT PHU chuyen tien ung ho dong bao lu lut (CT1111),100000
13/09/2024,CT nhanh 247 den: Vietinbank;ct1111;Chuyen tien CT (ct1111),100000
13/09/2024,Chuyen tien den tu NAPAS Noi dung: gia dinh mint chuyen tien ung ho dong bao bao lu con bao so 3,200000
13/09/2024,Chuyen tien den tu NAPAS Noi dung: LE HUU PHU chuyen khoan-130924-08:26:14 948371,1500000
13/09/2024,CT nhanh 247 den: NGHIEM THANH TRUNG chuyen tien (CT1111),300000
13/09/2024,TRIEU XUAN TUNG Chuyen tien (CT1111),50000
13/09/2024,CT nhanh 247 den: LAI PHUC LONG CHUYEN TIEN,4444
13/09/2024,CT nhanh 247 den: MBVCB.7019395731.538899.ung ho dong bao bi lu lut.,100000
13/09/2024,SAYVONGSA PHAYVAN Chuyen tien (CT1111),1000000
13/09/2024,CT nhanh 247 den: PHAN NGUYEN BAO NHI chuyen tien,100000
13/09/2024,CT nhanh 247 den: HO TRO DONG BAO LU LUT MIEN BACDUONG THI KIM NGOC CHUYEN TIEN (CT1111),500000
13/09/2024,Chuyen tien den tu NAPAS Noi dung: Uh Dong Bao FT24257908981580 (CT1111),100000
13/09/2024,Chuyen tien den tu NAPAS Noi dung: CO LEN DONG BAO TOI (CT1111),100000
13/09/2024,Chuyen tien den tu NAPAS Noi dung: NGUYEN LAM HONG THAM chuyen ung ho cuu tro FT24257484670654 (CT1111),250000
13/09/2024,Chuyen tien den tu NAPAS Noi dung: BUI THI CHUNG ung ho dong bao bao lut mien bac (CT1111),200000
13/09/2024,HOANG THI HAI YEN chuyen tien,500000
13/09/2024,CT nhanh 247 den: MBVCB.7019396726.540277.UNG HO TIEN CAC TINH MIEN BAC THIET HAI VE BAO YAGI.,100000
13/09/2024,Be Doan Khoi Nguyen ung ho dong bao lu lut (CT1111),500000
13/09/2024,CT nhanh 247 den: MBVCB.7019388615.540744.NGUYEN THI DUNG chuyen tien ung ho.,50000
13/09/2024,Chuyen tien den tu NAPAS Noi dung: IBFT PHAM MINH NHUT chuyen tien (CT1111),100000
13/09/2024,CT nhanh 247 den: cua it long nhieu con xin ung ho dong bao (CT1111),50000
13/09/2024,CT nhanh 247 den: DO VAN DOAN 227 NGUYEN VAN GIAP PHUONG CAU DIEN NAM TU LIEEM HA NOI,500000
13/09/2024,CT nhanh 247 den: NGUYEN VAN NHAN quyen gop,200000
13/09/2024,Chuyen tien den tu NAPAS Noi dung: Quyen gop ho tro dong bao vung lu lut (ct1111),500000
13/09/2024,cuu tro dong bao chiu thien tai (CT1111),1000000
13/09/2024,CT nhanh 247 den: Vietinbank;ct1111;HOANG THI PHUONG chuyen tien (ct1111),100000
13/09/2024,Chuyen tien den tu NAPAS Noi dung: Mong dong bao vuot qua nhung kho khan nay (CT1111),20634
13/09/2024,UNG HO DONG BAO LU LUT (CT1111),500000
13/09/2024,Chuyen tien den tu NAPAS Noi dung: Mien Bac co len,200000
13/09/2024,CT nhanh 247 den: Vietinbank;CT1111;KMH FC ung ho cuu tro dongbaomien Bac (CT1111),300000
13/09/2024,Chuyen tien den tu NAPAS Noi dung: Huynh Trong Hoai ung ho dong bao lu lut (CT1111),200000
13/09/2024,DUONG VAN SINH ung ho dong bao mien bac bi ngap lut do bao yagi,100000
13/09/2024,CT nhanh 247 den: MBVCB.7019390641.542954.DAM VAN TU ung ho dong bao thiet hai do con bao so 3.,20000
13/09/2024,NGUYEN HOAI PHUONG chuyen tien ung ho bao lut (CT1111),500000
13/09/2024,Chuyen tien den tu NAPAS Noi dung: BUI HONG QUAN ung ho khac phuc bao yagi,100000
13/09/2024,VU THANH LAM chuyen tien ung ho bao lu Mong mng binh an (CT1111),200000
13/09/2024,NGUYEN HUE PHUONG TRAM CT (CT1111),100000
13/09/2024,CT nhanh 247 den: MBVCB.7019398945.543318.LU THI MY NHU chuyen tien ung ho mien Bac chong lu.,500000
13/09/2024,CT nhanh 247 den: NGUYEN THI YEN VY Ung ho nguoi dan chiu anh huong do bao (CT1111),14539
13/09/2024,Chuyen tien den tu NAPAS Noi dung: IBFT LE CONG LUAN 0888813739 ho tro ba con vung lu chuc ba con manh khoe vuot qua luc kho khan nay (CT1111),500000
13/09/2024,CT nhanh 247 den: MBVCB.7019390426.542728.con xin ung ho chut tam long cua con den dong bao bi lu lut.,50000
13/09/2024,Chuyen tien den tu NAPAS Noi dung: NGUYEN THANH NHAN chuyen tien,30000
13/09/2024,gia dinh THOM MAI ung ho dong bao mien bac (CT1111),500000
13/09/2024,LE THAO VI chuyen tien (CT1111),50000
13/09/2024,BUI PHUONG LIEN Chuyen tien ung ho vung lu lut,200000
13/09/2024,Chuyen tien den tu NAPAS Noi dung: HA ANH TUAN chuyen tien,2000
13/09/2024,PHAM VIET HA Chuyen tien (CT1111),100000
13/09/2024,Chuyen tien den tu NAPAS Noi dung: Ung ho dong bao bi thiet hai do con bao so 3 (CT1111),5000000
13/09/2024,Chuyen tien den tu NAPAS Noi dung: IBFT NGUYEN THUY TRANG u ho lu lut mien bac (ct1111),1000000
13/09/2024,DO HAI YEN Chuyen tien,200000
13/09/2024,MAI THI TAM chuyen tien ung ho ba con lu lut (CT1111),50000
13/09/2024,"Chuyen tien den tu NAPAS Noi dung: La lanh dum la rach, thuong nguoi nhu the thuong than, mot mieng khi doi bang mot goi khi no,... (ct1111)",10000
13/09/2024,NGUYEN VAN VIET QUANG NINH UNG HO DONG BAO CHONG BAO (CT1111),500000
13/09/2024,CONG TY CP DTXD KHANH AN UNG HO DONG BAO ANH HUONG BAO SO 3 (CT1111),20000000
13/09/2024,CT nhanh 247 den: Vietinbank;111602391111;Mot sinh vien Campuchia hoc o Truong Dai Hoc Xay Hanoi lop66kg ung ho dong bao vung lu tai Viet Nam.,100000
13/09/2024,ung ho dong bao sau bao lu (CT1111),200000
13/09/2024,CT nhanh 247 den: NGUYEN NGOC TRUC chuyen tien,100000
13/09/2024,CT nhanh 247 den: MBVCB.7019393598.546328.DUONG THI MAI chuyen tien.,200000
13/09/2024,CT nhanh 247 den: LE THU TRANG chuyen tien ung ho lu lut mien bac (CT1111),500000
13/09/2024,CT nhanh 247 den: VU THI KIM DUNG CHUYEN TIEN HO TRO DONG BAO THIET HAI DO BAO SO 3,500000
13/09/2024,Ung ho dong bao anh huong bao yagi,500000
13/09/2024,Chuyen tien den tu NAPAS Noi dung: NGUYEN TUAN BINH ung ho dong bao lu lut FT24257539804703,200000
13/09/2024,TRAN THI HAU chuyen tien ung ho vung lu (CT1111),200000
13/09/2024,Chuyen tien den tu NAPAS Noi dung: TRAN NGOC LUYN chuyen tien ung ho mien bac FT24257976040378,100000
13/09/2024,NGUYEN THI THAM chuyen tien ung ho cuu tro vung lu lut,100000
13/09/2024,Minh xin phep duoc quyen gop mot phan nho de giup giup do dong bao mien Bac vuot qua thien tai (CT1111),500000
13/09/2024,PHAM HOANG MINH QUAN chuyen tien,500000
13/09/2024,LE AI NGOC LIEN chuyen tien,50000
13/09/2024,CT nhanh 247 den: Vietinbank;111602391111;LUONG THI NHUNG song ma son la chuyen tien ung ho dong bao do con bao so 3,500000
13/09/2024,TRAN MINH CANH Chuyen tien,100000
13/09/2024,Chuyen tien den tu NAPAS Noi dung: TRAN HOAI NAM chuyen ung ho bao lut FT24257237501816 (CT1111),5000000
13/09/2024,LE THI CAM LAC Chuyen tien (CT1111),200000
13/09/2024,CT nhanh 247 den: NGUYEN TRAN THANG CHUYEN TIEN UNG HO BA CON VUNG LU (CT1111),50000
13/09/2024,CT nhanh 247 den: UNG HO DONG BAO BI LU (CT1111),100000
13/09/2024,CT nhanh 247 den: DAO QUANG VINH ung ho nguoi dan vung lu mien bac (CT1111),100000
13/09/2024,VU THI PHUONG Hai Phong chuyen tien ung ho ba con vung lu (CT1111),200000
13/09/2024,NGUYEN QUOC TONG Chuyen tien ung ho cuu tro (CT1111),9000
13/09/2024,Chuyen tien den tu NAPAS Noi dung: vo chong hiep thuy ung ho ba con bi anh huong con bao so 3. chuc ba con binh an (CT1111),500000
13/09/2024,CT nhanh 247 den: MBVCB.7019407213.550654.TRAN THI HANG chuyen tien.,200000
13/09/2024,Chuyen tien den tu NAPAS Noi dung: DUONG THI HA VIET KIEU CANADA UNG HO DONG BAO BI BAO LU-130924- 08:28:42 950981 (ct1111),5000000
13/09/2024,CT nhanh 247 den: MBVCB.7019406991.550411.Tap the anh em VNPT Media GPPM ung ho.,10000
13/09/2024,DO HOANG PHUONG AN chuyen tien,1000000
13/09/2024,CT nhanh 247 den: Vietinbank;CT1111;TRINH THI THUONG chuyen tien (CT1111),200000
13/09/2024,Chuyen tien den tu NAPAS Noi dung: BUI NGOC ANH FT24257509621620 (CT1111),300000
13/09/2024,NGUYEN THANH TUAN chuyen tien UNG HO DONG BAO MIEN BAC (CT1111),200000
13/09/2024,CT nhanh 247 den: HUYNH HUY QUYEN CHUYEN TIEN (CT1111),200000
13/09/2024,BUI THI NHU QUYNH chuyen tien ung ho mien bac,200000
13/09/2024,xin se chia cho ba con bi lu lut (CT1111),500000
13/09/2024,CT nhanh 247 den: HOANG THI KIM NGAN chuyen tien: ung ho vung lu lut (CT1111),50000
13/09/2024,Chuyen tien den tu NAPAS Noi dung: TRAN HOAI LINH chuyen tien ung ho dong bao mien trung,100000
13/09/2024,Hong - Mui_copiao-Ai Quoc-Loc Binh-Lang Son (CT1111),50000
13/09/2024,CT nhanh 247 den: Vietinbank;CT1111;DANG THI HONG TRANG chuyen tien (CT1111),100000
13/09/2024,Gia dinh Bap ung ho lu lut (CT1111),1000000
13/09/2024,Chuyen tien den tu NAPAS Noi dung: LE HOANG DUONG VA LE THI NGOC UNG HO DONG BAO MIEN BAC-130924-08:29:08 951438 (CT1111),500000
13/09/2024,LE HONG SON Chuyen tien,500000
13/09/2024,mong moi nguoi binh an de ve nha (CT1111),100000
13/09/2024,ung ho khac phuc thien tai (CT1111),2000000
13/09/2024,LE VAN TUAN chuyen tien (CT1111),1000000
13/09/2024,Chuyen tien den tu NAPAS Noi dung: Ung ho Dong Bao Mien Bac vuot qua kho khan,500000
13/09/2024,BUI THI HOAI THU Chuyen tien ung ho dong bao thiet hai do bao so 3 gay ra (CT1111),500000
13/09/2024,Chuyen tien den tu NAPAS Noi dung: GIA DINH HONG TUAN DONG NAI GUI DONG BAO MIEN BAC-130924-08:29:26 951717,500000
13/09/2024,Chuyen tien den tu NAPAS Noi dung: GIA DINH DUC HANG TU SON BAC NINH UNG HO KHAC PHUC BAO YAGI (CT1111),200000
13/09/2024,Chuyen tien den tu NAPAS Noi dung: NGUYEN THI THU ANH chuyen tien FT24257306999561,200000
13/09/2024,Chuyen tien den tu NAPAS Noi dung: Ung ho dong bao lu lut. (CT1111),100000
13/09/2024,CT nhanh 247 den: TRINH DINH THANH chuyen tien,15000
13/09/2024,TRUONG MINH THUAN chuyen tien cuutrobao - mong binh an,1000000
13/09/2024,NGUYEN BA MINH LUAN chuyen tien (CT1111),1000000
13/09/2024,CT nhanh 247 den: Vietinbank;CT1111;le thi doan ck ung ho ba con vung bao (CT1111),5000000
13/09/2024,"Chuyen tien den tu NAPAS Noi dung: chau cung dang kho khan nen khong co nhieu, chut tam long gui den dong bao vung lu lut. Mong ba con som on dinh cuoc song. (CT1111)",50000
13/09/2024,VUONG NHU TUONG Chuyen tien (CT1111),500000
13/09/2024,Chuyen tien den tu NAPAS Noi dung: ung ho ba con vung lu (CT1111),500000
13/09/2024,Chuyen tien den tu NAPAS Noi dung: Ung ho dong bao thiet hai do bao so 3 (CT1111),123456
13/09/2024,CT nhanh 247 den: VU THI QUYNH chuyen tien,50000
13/09/2024,VU THI HOAI ung ho dong bao khac phuc bao lu,100000
13/09/2024,CT nhanh 247 den: THAODUNG UNG HO NGUOI DAN CHONG LU LUT (CT1111),200000
13/09/2024,Chuyen tien den tu NAPAS Noi dung: Gop chut tam long ung ho dong bao mien bac (CT1111),500000
13/09/2024,VU NGOC TU chuyen tien,100000
13/09/2024,LE THI NGA chuyen tien (CT1111),500000
13/09/2024,CT nhanh 247 den: MBVCB.7019419059.555821.TRUONG NGUYET ANH chuyen tien ung ho lu lut.,500000
13/09/2024,Chuyen tien den tu NAPAS Noi dung: Gia dinh Van Chien Ha Dong Ha Noi ung ho,5000000
13/09/2024,Chuyen tien den tu NAPAS Noi dung: YAGI- 130924-08:30:00 952390 (CT1111),3000000
13/09/2024,CT nhanh 247 den: VU TRUNG KIEN CHUYEN TIEN UNG HO DONG BAO VUNG LU,500000
13/09/2024,CT nhanh 247 den: Vietinbank;CT1111;Da chau Huynh Tan Du va Tran Thi Thao Linh chuc dong bao mien Bac vung niem tin tron binh an (CT1111),515999
13/09/2024,NGUYEN KIM NGOC chuyen tien,200000
13/09/2024,Chuyen tien den tu NAPAS Noi dung: HO THI KIM NHUNG chuyen khoan-130924- 08:30:05 952440,100000
13/09/2024,CT nhanh 247 den: DAO VAN NAM UNG HO NGUOI DAN VUNG BAO SO 3 (CT1111),100000
13/09/2024,Chuyen tien den tu NAPAS Noi dung: Ung ho ba con bao Yagi,2000000
13/09/2024,CT nhanh 247 den: DA MINH HY chuyen tien (CT1111),100000
13/09/2024,Chuyen tien den tu NAPAS Noi dung: fan Luu Vu VN ung ho ba con vung lu (CT1111),24800
13/09/2024,CT nhanh 247 den: MBVCB.7019413962.559088.GIAP VAN THANH chuyen tien.,500000
13/09/2024,3 c-e chau Dieu Linh- Mai Trang-Thai Son ung ho dong bao lu (CT1111),500000
13/09/2024,CT nhanh 247 den: mong dong bao som vuot qua kho khan nay,50000
13/09/2024,CT nhanh 247 den: MBVCB.7019422720.559943.VOTHAO UNG HO BA CON VUNG LU LUT VA BI ANH HUONG CUA BAO YAGI.,200000
13/09/2024,Chuyen tien den tu NAPAS Noi dung: Nhu Van Son chuyen tien (CT1111),500000
13/09/2024,DINH VAN DIEN chuyen tien ung ho dong bao lu lut (CT1111),500000
13/09/2024,CT nhanh 247 den: Vietinbank;111602391111;ung ho dong bao thiet hai do con bao so 3,50000
13/09/2024,CT nhanh 247 den: UNG HO DONG BAO BI THIET HAI DO SON BAO SO 3 (CT1111),200000
13/09/2024,TRINH KHAI SIEU Chuyen tien ung ho dong bao mien Bac (CT1111),100000
13/09/2024,CAN VAN XUAN Chuyen tien (CT1111),200000
13/09/2024,NGUYEN THI HANG chuyen tien,100000
13/09/2024,CT nhanh 247 den: NGUYEN ANH TAI CLB CAU LONG A5 AB UNG HO KHAC PHUC BAO SO 3 (CT1111),1000000
13/09/2024,Chuyen tien den tu NAPAS Noi dung: Tran Trinh Duy Khanh chuyen tien,50000
13/09/2024,Chuyen tien den tu NAPAS Noi dung: PHAM VAN HOAN chuyen FT24257553373107 (CT1111),500000
13/09/2024,CAO VAN HIEU ung ho dong bao bao lu (CT1111),200000
13/09/2024,CT nhanh 247 den: TRAN HA NGOC HUYEN chuyen tien,50000
13/09/2024,NGUYEN TAN NANG Chuyen tien,100000
13/09/2024,Chuyen tien den tu NAPAS Noi dung: DO TRUONG VUONG CHUYEN KHOAN UNG HO DONG BAO MB-130924-08:30:50 953219 (CT1111),300000
13/09/2024,NGUYEN THI NGOC HUONG chuyen tien (CT1111),500000
13/09/2024,LE THI THANH THAO Chuyen tien ho tro dong BAO mien Bac,500000
13/09/2024,Chuyen tien den tu NAPAS Noi dung: HUYNH THI MONG TUYEN chuyen tien ung ho dong bao lu lut (CT1111),500000
13/09/2024,Chuyen tien den tu NAPAS Noi dung: PHAN THI THU PHUONG ung ho mien bac bao so3,200000
13/09/2024,HO VAN TY Chuyen tien,100000
13/09/2024,NGUYEN TRUNG HAI Chuyen tien (CT1111),12345
