date,content,money
13/09/2024,CT nhanh 247 den: XIN UNG HO DONG BAO VUNG LU MIEN BAC,100000
13/09/2024,Chuyen tien den tu NAPAS Noi dung: Chia se voi dong bao bi lu lut (CT1111),500000
13/09/2024,NGUYEN NHAT ANH chuyen tien giup do dong bao khac phuc hau qua bao YAGI (CT1111),500000
13/09/2024,Chuyen tien den tu NAPAS Noi dung: TRAN HA MY ho tro ng dan mien bac FT24257507977812 (CT1111),100000
13/09/2024,NGO THANH HOANG chuyen tien ung ho dong bao bao lut,1000000
13/09/2024,CT nhanh 247 den: NGUYEN DUC TIEP chuyen tien (CT1111),50000
13/09/2024,Chuyen tien den tu NAPAS Noi dung: DAO THI DIEM MY chuyen FT24257551003418 (CT1111),222200
13/09/2024,1 sv cua dhy (CT1111),20000
13/09/2024,Chuyen tien den tu NAPAS Noi dung: PHAM NGOC QUYNH HUONG chuyen tien qua MoMo (CT1111),21000
13/09/2024,NGUYEN THI GIANG chuyen tien ung ho khac phuc bao yagi (CT1111),200000
13/09/2024,Chuyen tien den tu NAPAS Noi dung: ck FT24257538536800 (CT1111),500000
13/09/2024,Chuyen tien den tu NAPAS Noi dung: mong moi nguoi binh an (CT1111),100000
13/09/2024,CT nhanh 247 den: MBVCB.7018354125.909212.arm ung ho dong bao lu lut.,100000
13/09/2024,PHAM VAN GIANG Chuyen tien ung ho NDMB khac phuc hau qua bao yagi (CT1111),200000
13/09/2024,BUI MINH DUC chuyen tien ung ho dong bao lu lut,500000
13/09/2024,CT nhanh 247 den: NGUYEN DUC TRUNG chuyen tien (CT1111),500000
13/09/2024,Chuyen tien den tu NAPAS Noi dung: MAI THI HAI YEN chuyen tien (by TPBank ChatPay) (ct1111),100000
13/09/2024,Chuyen tien den tu NAPAS Noi dung: Dong bao mien Bac co len (CT1111),100000
13/09/2024,NGUYEN THI YEN Chuyen tien ung ho nguoi dan vung bao lu (CT1111),100000
13/09/2024,CT nhanh 247 den: em Hieu cty tnhh xnk va thuong mai tram anh melody ung ho dong bao lu lut (CT1111),1000000
13/09/2024,CT nhanh 247 den: ung ho dong bao mien bac vuot qua lu lut (CT1111),50000
13/09/2024,CT (CT1111),2000000
13/09/2024,Nhi huy gop suc nho ung ho cuu tro bao lu ah (CT1111),600000
13/09/2024,CT nhanh 247 den: PHAM HUYNH NHU KHUYEN chuyen tien (CT1111),50000
13/09/2024,CT nhanh 247 den: OK (CT1111),200000
13/09/2024,CT nhanh 247 den: TRAN UYEN PHUONG chuyen tien (CT1111),10000
13/09/2024,DINH VIET THUC ung ho dong bao bao lu (CT1111),200000
13/09/2024,CT nhanh 247 den: CHAU KO CO NHIEU VI GD CHAU CX KO CO DIEU KIEN BME CHAU KO LAM RA TIEN CHAU CX CHUA CO VC LAM 1 CHUT IT OI GOP SUC DONGBAO TA DOAN KET TIEN LIEN NHE (CT1111),20000
13/09/2024,CT nhanh 247 den: MBVCB.7018367513.912529.DO THI HAU GIANG chuyen tien ung ho dong bao lu lut.,50000
13/09/2024,CT nhanh 247 den: Chung tay vi dong mau Viet,1000000
13/09/2024,Chuyen tien den tu NAPAS Noi dung: Ung ho dong bao sau bao yagi (ct1111),50000
13/09/2024,Chuyen tien den tu NAPAS Noi dung: IBFT DANG NHU NGUYET chuyen tien (CT1111),500000
13/09/2024,HA LINH GIANG ung ho dong bao (CT1111),50000
13/09/2024,Chuyen tien den tu NAPAS Noi dung: VU QUOC VIET FT24257550878364 (CT1111),500000
13/09/2024,Chuyen tien ho tro dong bao lu lut (CT1111),500000
13/09/2024,CT nhanh 247 den: BUI THANH MAI UNG HO NGUOI DAN BI THIET HAI DO CON BAO SO 3 YAGI GAY RA (CT1111),250000
13/09/2024,CT nhanh 247 den: MBVCB.7018368589.913932.PHONG nguoi nho lam viec nho.,200000
13/09/2024,CT nhanh 247 den: TRAN PHUONG NHI chuyen tien,100000
13/09/2024,Chuyen tien den tu NAPAS Noi dung: NGUYEN HOANG BAO CHAU chuyen tien qua MoMo (CT1111),50000
13/09/2024,CT nhanh 247 den: MBVCB.7018360962.914272.ck.,2000000
13/09/2024,CT nhanh 247 den: chau xin duoc gop chut it toi moi nguoi a (CT1111),105000
13/09/2024,CT nhanh 247 den: Vietinbank;CT1111;CAO VAN HIEU chuyen tien ung ho dong bao lu lut sau con bao so 3 (CT1111),300000
13/09/2024,Chau xin ung ho nguoi dan va bo doi tham gia khac phu hau qua bao so 3. Xin tran thanh cam on (CT1111),200000
13/09/2024,Chuyen tien den tu NAPAS Noi dung: CUU TRO-130924-02:33:44 824996 (CT1111),500000
13/09/2024,CT nhanh 247 den: ung ho dong bao lu lut (CT1111),100000
13/09/2024,Chuyen tien den tu NAPAS Noi dung: Ung ho dong bao bi thiet hai do bao so 3 FT24257804616890 (CT1111),500000
13/09/2024,CT nhanh 247 den: NGUYEN THI OANH chuyen tien ung ho nguoi dan anh huong con bao so 3 yagi (CT1111),200000
13/09/2024,Narukami ung ho nhan dan Viet Nam,200000
13/09/2024,CT nhanh 247 den: ca nuoc ta co len (CT1111),20000
13/09/2024,CT nhanh 247 den: NGUYEN VAN KHANH chuyen tien,100000
13/09/2024,Chuyen tien den tu NAPAS Noi dung: IBFT LE THUY VUY chuyen tien,51000
13/09/2024,VO THI THU THUY Chuyen tien,200000
13/09/2024,CT nhanh 247 den: NGUYEN HONG MINH CUA IT LONG NHIEU MONG MOI NGUOI BINH AN (CT1111),200000
13/09/2024,Chuyen tien den tu NAPAS Noi dung: IBFT Unghodb (CT1111),50000
13/09/2024,CT nhanh 247 den: CHAU TU ANH 7 TUOI UNG HO DONG BAO LU LUT (CT1111),900000
13/09/2024,Nguyen Vu Anh Thy quyen gop dong bao bi lu lut (CT1111),139000
13/09/2024,Chuyen tien den tu NAPAS Noi dung: VU ANH DUC ung ho dong bao bi thiet hai do bao so 3 (CT1111),1000000
13/09/2024,Chuyen tien den tu NAPAS Noi dung: TRAN DUC KHANG chuyen tien (CT1111),10000
13/09/2024,Chuyen tien den tu NAPAS Noi dung: LE DINH HUY CHUYEN KHOAN (CT1111),100000
13/09/2024,CT nhanh 247 den: DUONG THI DIEM QUYNH ung ho mong moi nguoi binh an (CT1111),50000
13/09/2024,"Chuyen tien den tu NAPAS Noi dung: em con di hoc chua lam ra nhieu tien,em gop chut it mong nguoi dan luon manh khoe va som vuot qua con bao a FT24257397823256 (CT1111)",100000
13/09/2024,Luna (CT1111),1000000
13/09/2024,Chuyen tien den tu NAPAS Noi dung: IBFT ung ho dong bao mien Bac,200000
13/09/2024,CT nhanh 247 den: DUONG THI HUYEN CHUYEN TIEN (CT1111),100000
13/09/2024,nguoi ngheo xin phep dong gop cho nguoi ngheo a (CT1111),100000
13/09/2024,Chuyen tien den tu NAPAS Noi dung: con gui tam long den nguoi dong bao Mien Bac (CT1111),300000
13/09/2024,Chuyen tien den tu NAPAS Noi dung: IBFT VUONG DINH KHANH ung ho Viet Nam (CT1111),1000000
13/09/2024,Chuyen tien den tu NAPAS Noi dung: NGUYEN VAN TAI chuyen tien FT24257211580041,2000000
13/09/2024,NGUYEN XUAN QUANG chuyen tien,100000
13/09/2024,CT nhanh 247 den: Ung ho dong bao mien Bac vuot qua lu lut (CT1111),50000
13/09/2024,CT nhanh 247 den: ung ho vung lu lut (CT1111),200000
13/09/2024,NGUYEN VAN HOAN ung ho dong bao lu lut...,200000
13/09/2024,Chuyen tien den tu NAPAS Noi dung: LUONG THI NGOC THANH transfers FT24257290020712,100000
13/09/2024,CT nhanh 247 den: CHUYEN TIEN CUU TRO LU LUT MIEN BAC 2024,2000000
13/09/2024,NGUYEN THAI DUONG chuyen tien (CT1111),5000000
13/09/2024,Chuyen tien den tu NAPAS Noi dung: VU MINH DIEN ung ho ba con dong bao vung lu FT24257423295225 (CT1111),200000
13/09/2024,TRAN NU HOANG UNG HO DONG BAO KHAC PHUC HAU QUA BAO SO 3,50000
13/09/2024,mot chut tam long den dong bao gap lu,3000000
13/09/2024,Chuyen tien den tu NAPAS Noi dung: Ung ho dong bao mien Bac vuot qua bo Yagi (Ct1111),500000
13/09/2024,CT nhanh 247 den: gop suc nho den dong bao mien Bac (CT1111),100000
13/09/2024,Gia dinh Dong Phu Vinh va Vu Huy Hoang gop mot phan nho vi dong bao than thuong va To Quoc Viet Nam. (CT1111),200000
13/09/2024,Viet Nam co len (CT1111),200000
13/09/2024,Chuyen tien den tu NAPAS Noi dung: LE DANG GIANG TUNG ung ho khac phuc bao lu (CT1111),100000
13/09/2024,CT nhanh 247 den: MBVCB.7018385374.922083.TA ANH TRUNG xin duoc quyen gop.,50000
13/09/2024,CT nhanh 247 den: VO HUYNH THI KIM NGAN chuyen tien (CT1111),30000
13/09/2024,CT nhanh 247 den: DUONG LE HOP chuyen tien ung ho mien Bac yeu thuong (CT1111),300000
13/09/2024,Mong dat nuoc binh an.... (CT1111),200000
13/09/2024,Chuyen tien den tu NAPAS Noi dung: LE THI KIM CHI chuyen FT24257304870480,100000
13/09/2024,CT nhanh 247 den: PHAM THAO LINH chuyen tien (CT1111),500000
13/09/2024,CT nhanh 247 den: MBVCB.7018376318.922447.ung ho dong bao lu lut.,30000
13/09/2024,Cau mong binh an den voi moi nguoi- VyAndy from hcm with luv (CT1111),100000
13/09/2024,CT nhanh 247 den: ho tro bao yagi (CT1111),150000
13/09/2024,Chuyen tien den tu NAPAS Noi dung: Ha Kim Mai chuyen tien (CT1111),50000
13/09/2024,Chuyen tien den tu NAPAS Noi dung: That nghiep cua it long nhieu Con xin chia se voi ca nuoc,25354
13/09/2024,Chuyen tien den tu NAPAS Noi dung: Ngheo thich du. Ung ho bao lu FT24257254070342 (CT1111),500000
13/09/2024,CT nhanh 247 den: NGUYEN HONG PHUC chuyen tien (CT1111),10000
13/09/2024,NGUYEN NGOC NHU chuyen tien,50000
13/09/2024,CT nhanh 247 den: Du so tien con quyen gop khong nhieu nhung con mong moi nguoi se vuot qua a.,100000
13/09/2024,CT nhanh 247 den: TRAN HUYEN TRANG chuyen tien ung ho dong bao sau con bao Yagi. Mong dong bao duoc binh an. (CT1111),100000
13/09/2024,Chuyen tien den tu NAPAS Noi dung: Donation typhoon Yagi Donation typhoon Yagi (CT1111),200000
13/09/2024,DUONG THI KIM THUY chuyen tien,54980
13/09/2024,Chuyen tien den tu NAPAS Noi dung: vi vietnam than yeu (CT1111),2000000
13/09/2024,CT nhanh 247 den: MBVCB.7018386124.924372.PHAN DIEP GIA HUY mong ba con vung bao lu mau chong vuot qua.,500000
13/09/2024,Chuyen tien den tu NAPAS Noi dung: Sent by Huynh My Phung from my Timo (CT1111),3000000
13/09/2024,CT nhanh 247 den: BUI PHAM TUONG VY chuyen tien. con xin dong gop 1 phan nho cho nguoi dan bi anh huong bao yagi a (CT1111),20000
13/09/2024,Chuyen tien den tu NAPAS Noi dung: NGUYEN HONG NHUNG chuyen tien (ct1111),500000
13/09/2024,Chuyen tien den tu NAPAS Noi dung: Dong Thao ung ho khac phuc bao lut FT24257740517003,200000
13/09/2024,Chuyen tien den tu NAPAS Noi dung: Thien An - cua it long nhieu mong ba con vuot qua ah (CT1111),300000
13/09/2024,CT nhanh 247 den: DAO VAN NGUYEN chuyen tien (CT1111),100000
13/09/2024,CT nhanh 247 den: NGUYEN KIM MINH THUONG chuyen tien (CT1111),150000
13/09/2024,HOANG VAN HIEU chuyen tien (CT1111),25361
13/09/2024,Chuyen tien den tu NAPAS Noi dung: DANG MINH TRUONG chuyen ung ho bao so 3 theo thu keu goi cua dsq vn tai canada FT24257524644817 (CT1111),5000000
13/09/2024,TOAI VY HAAN Gui ba con Mien Bac (CT1111),1000000
13/09/2024,ho tro ba con lu lut (CT1111),25000
13/09/2024,Chuyen tien den tu NAPAS Noi dung: DUONG BAO NHI chuyen tien FT24257101514255,300000
13/09/2024,CT nhanh 247 den: MBVCB.7018387607.927258.ung ho dong bao lu lut.,10000
13/09/2024,...,10000
13/09/2024,NGUYEN CANH SANG Chuyen tien,5000
13/09/2024,NGUYEN THI THANH HANG Transfers (CT1111),350000
13/09/2024,CT nhanh 247 den: mong dong bao mau vuot qua kho khan (CT1111),150000
13/09/2024,Chuyen tien den tu NAPAS Noi dung: Avocadosmoothies ung ho dong bao mien Trung,2179995
13/09/2024,CT nhanh 247 den: Em la sv khong co nhieu tien cua it long nhieu mong mien bac vuot qua kho khan a (CT1111),50000
13/09/2024,CT nhanh 247 den: NGUYEN THI TRUONG PHI chuyen tien (CT1111),50000
13/09/2024,CT nhanh 247 den: gui dong bao mien bac (CT1111),2000000
13/09/2024,Chuyen tien den tu NAPAS Noi dung: LE THI DIU CHUYEN KHOAN BAN VAN DONG CUU TRO TRUNG UONG Ung ho dong bao MB lu lut (CT1111),200000
13/09/2024,CT nhanh 247 den: Con xin gui chut tam long nho den ba con mong ba con vuot qua duoc kho khan nay va binh an. (CT1111),100000
13/09/2024,Chuyen tien den tu NAPAS Noi dung: Dong tam gop suc cuu tro cac gia dinh bi anh huong do bao lu FT24257203377684 (CT1111),1000000
13/09/2024,cuu tro dong bao do con bao so 3 (CT1111),100000
13/09/2024,Chuyen tien den tu NAPAS Noi dung: TRAN VAN DUC chuyen ung ho dong bao sau con bao yagi FT24257309032502 (CT1111),100000
13/09/2024,ung ho bao lu mien bac,500000
13/09/2024,TRAN VAN KHA Chuyen tien ung ho khac phuc hau qua con bao YAGI (CT1111),1000000
13/09/2024,HA VAN TUAN chuyen tien Ung Ho Nguoi Dan Bao Lu Mien Bac (CT1111),1000000
13/09/2024,Chuyen tien den tu NAPAS Noi dung: Gia dinh Gau gui den dong bao (CT1111),2600000
13/09/2024,Chuyen tien den tu NAPAS Noi dung: NGUYEN DINH THUAN chuyen tien (CT1111),200000
13/09/2024,CT nhanh 247 den: Vietinbank;CT1111;Nguyen Thanh An ung ho mien Bac than yeu (CT1111),200000
13/09/2024,Chuyen tien den tu NAPAS Noi dung: PHAM THI HUONG LY chuyen tien (CT1111),100000
13/09/2024,Chuyen tien den tu NAPAS Noi dung: Ung ho dong bao (CT1111),65000
13/09/2024,Chuyen tien den tu NAPAS Noi dung: Ung Ho Dong Bao Bi Thien Tai Mien Bac (CT1111),5000000
13/09/2024,Chuyen tien den tu NAPAS Noi dung: LUONG DUC ANH chuyen tien,2000
13/09/2024,Chuyen tien den tu NAPAS Noi dung: Toi yeu viet nam (CT1111),200000
13/09/2024,Chuyen tien den tu NAPAS Noi dung: Ung ho dong bao mien bac FT24257203409445 (CT1111),1000000
13/09/2024,NGO THI OANH chuyen tien ung ho dong bao,500000
13/09/2024,CT nhanh 247 den: Pham Nguyen Phuong Tram ung ho ba con lu lut (CT1111),1000000
13/09/2024,Chuyen tien den tu NAPAS Noi dung: Doan Gia Tam Thieu quyen gop ung ho dong bao vuot qua con bao so 3 (CT1111),500000
13/09/2024,Chuyen tien den tu NAPAS Noi dung: NGUYEN HOANG HAI MY chuyen tien qua MoMo (CT1111),1000000
13/09/2024,Chuyen tien den tu NAPAS Noi dung: LE THI CAM TIEN xin gop 1 it cho nguoi dan vung lu lut mong mn luon binh an manh me (CT1111),1000000
13/09/2024,CT nhanh 247 den: DO VAN TAN chuyen tien (CT1111),13000
13/09/2024,TRINH NGOC TUYEN ung ho dong bao bi thiet hai do con bao so3 gay ra (CT1111),500000
13/09/2024,CT nhanh 247 den: ung ho moi nguoi (CT1111),200000
13/09/2024,Chuyen tien den tu NAPAS Noi dung: Quyen gop dong bao mien bac (CT1111),30000
13/09/2024,NGUYEN THANH NAM,100000
13/09/2024,CT nhanh 247 den: nglemith gui chut it tam long den khu vuc MB. Tich Tieu Thanh Dai,50000
13/09/2024,ung ho dong bao bi bao yagi.,200000
13/09/2024,Chuyen tien den tu NAPAS Noi dung: NGUYEN THI DIEP ung ho dong bao chiu thiet hai do bao Yagi (CT1111),500000
13/09/2024,minh co 1 chut ung ho moi nguoi a (CT1111),100000
13/09/2024,Chuyen tien den tu NAPAS Noi dung: Ho tro nguoi dan bi thien tai,500000
13/09/2024,NGUYEN XUAN TRUONG chuyen tien (CT1111),2000000
13/09/2024,CT nhanh 247 den: ung ho lu lut,500000
13/09/2024,Ung ho dong bao mien Bac (CT1111),500000
13/09/2024,gd LE THI MINH HUYEN ung ho dong bao vuot bao so 3 (CT1111),500000
13/09/2024,"Chuyen tien den tu NAPAS Noi dung: em Luong gui chut tam long nho, One Love One Future (CT1111)",100000
13/09/2024,HA KHANH VY Chuyen tien (CT1111),11265
13/09/2024,CT nhanh 247 den: MBVCB.7018399725.934806.NGUYEN THANH BINH chuyen tien.,100000
13/09/2024,DUONG MINH THINH chuyen tien,100000
13/09/2024,BUI THU HUYEN Chuyen tien mong mot chut nho cua e co the giup DC moi ng a (CT1111),100000
13/09/2024,CT nhanh 247 den: MBVCB.7018391121.935263.GIANG THI PHUA chuyen tien.,100000
13/09/2024,ung ho lu lut (CT1111),500000
13/09/2024,Chuyen tien den tu NAPAS Noi dung: PHAN THAI SON UNG HO DONG BAO LU LUT (CT1111),20000
13/09/2024,CT nhanh 247 den: MBVCB.7018400737.935633.LE TIEN DUNG.,5000
13/09/2024,Chuyen tien den tu NAPAS Noi dung: BUI HOANG YEN ung ho dong bao bao lut mien Bac 2024 FT24257804810460 (CT1111),1000000
13/09/2024,CT nhanh 247 den: MBVCB.7018400859.935754.con Pham Thi Bao Ngoc va Pham Minh Tien tran trong ung hoaa.,200000
13/09/2024,CT nhanh 247 den: MAI THI HONG NHUNG ung ho dong bao mien bac bao yagi (CT1111),3000000
13/09/2024,66699224205-0367011534-LUONG DUC ANH chuyen tien qua MoMo,2000
13/09/2024,ung ho dong bao lu mien Bac,200000
13/09/2024,HOANG THI THU THUY ung ho dong bao lu lut do con bao so 3. (CT1111),5000000
13/09/2024,DUONG QUOC DAT Chuyen tien ung ho bao so 3,200000
13/09/2024,LE QUANG PHAT Chuyen tien (CT1111),10000
13/09/2024,CT nhanh 247 den: NGUYEN THI THANH TAM chuyen tien CUU TRO BAO YAGI,25000
13/09/2024,CT nhanh 247 den: HOANG HAI BANG ung ho (CT1111),40000
13/09/2024,Chuyen tien den tu NAPAS Noi dung: DINH THI HONG PHUONG chuyen FT24257063127295 (CT1111),100000
13/09/2024,NGUYEN THI HANG Chuyen tien ung ho (CT1111),150000
13/09/2024,VU THE ANH chuyen tien,100000
13/09/2024,Chuyen tien den tu NAPAS Noi dung: NGO HONG KIM DUYEN chuyen FT24257830808498 (CT1111),20000
13/09/2024,Chuyen tien den tu NAPAS Noi dung: Lai Nguyen Minh Quan con ung ho dong bao vung lu FT24257638866090 (CT1111),200000
13/09/2024,ung ho dong bao mien Bac (CT1111),200000
13/09/2024,chuyen tien cuu tro thien tai (CT1111),25000
13/09/2024,Chuyen tien den tu NAPAS Noi dung: Rio Matt Quang Minh con ung ho dong bao vung lu FT24257706355979 (CT1111),200000
13/09/2024,Chuyen tien den tu NAPAS Noi dung: Hoang Anh va Xuan Anh ung ho mot chut tam long FT24257030140770 (CT1111),131222
13/09/2024,NGO MANH TUAN Chuyen tien,100000
13/09/2024,Chuyen tien den tu NAPAS Noi dung: PHAM THI DUONG chuyen ung ho dong bao mien bac FT24257008219056 (CT1111),200000
13/09/2024,CT nhanh 247 den: BUI THUY TRANG chuyen tien (CT1111),30000
13/09/2024,Chuyen tien den tu NAPAS Noi dung: Lai Tran An ung ho dong bao vung lu FT24257972578390 (CT1111),500000
13/09/2024,PHAM NGOC THU TRANG chuyen tien,200000
13/09/2024,Chuyen tien den tu NAPAS Noi dung: TRAN MINH TRI chuyen FT24257110531088 (CT1111),3000000
13/09/2024,Chuyen tien den tu NAPAS Noi dung: Me Minh va Ti ung ho dong bao vung lu FT24257317226009 (CT1111),500000
13/09/2024,NGUYEN QUY DUONG chuyen tien ung ho dong bao lu lut,200000
13/09/2024,NGUYEN THI HUONG NGAN tu thien day lui bao lu,100000
13/09/2024,Chuyen tien den tu NAPAS Noi dung: NGUYEN THANH SANG chuyen tien den BAN VAN DONG CUU TRO TRUNG UONG - ct1111 (ct1111),500000
13/09/2024,CT nhanh 247 den: BUI THI CHUNG UNG HO DONG BAO THIET HAI BAO YAGI (CT1111),500000
13/09/2024,Chuyen tien den tu NAPAS Noi dung: Chuyen tien 24x7 qua so tai khoan (CT1111),100000
13/09/2024,Chuyen tien den tu NAPAS Noi dung: NGUYEN DANG DANG chuyen tien giup ba con bi anh huong bao lu. FT24257706383923 (CT1111),1000000
13/09/2024,CT nhanh 247 den: An Nguyen ung ho lu lut. (CT1111),2000000
13/09/2024,CT nhanh 247 den: LE QUANG NGHIEM chuyen tien,100000
13/09/2024,CT nhanh 247 den: Vietinbank;111602391111;THAI THI THANH TRUC chuyen tien ung ho dong bao bao lut,500000
13/09/2024,Chuyen tien den tu NAPAS Noi dung: LUONG DUC ANH chuyen tien,2000
13/09/2024,thuy moc ung ho ba con vung lu (CT1111),300000
13/09/2024,CT nhanh 247 den: EM NGUYEN HAI BINH UNG HO DONG BAO BAO LU A (CT1111),50000
13/09/2024,CT nhanh 247 den: TRAN HUU TAM chuyen tien cuu tro dong bao bi bao lu (CT1111),100000
13/09/2024,Chuyen tien den tu NAPAS Noi dung: EM TRUONG PHAM va BAN GAI ca si ChiPU ung ho ba con Mien Bac khac phuc bao YAGI (CT1111),1461993
13/09/2024,CT nhanh 247 den: Vietinbank;111602391111;chung tay ung ho dong bao,500000
13/09/2024,Chuyen tien den tu NAPAS Noi dung: TRAN CHAU TRINH chuyen tien qua MoMo (CT1111),200000
13/09/2024,Chuyen tien den tu NAPAS Noi dung: Ungho (CT1111),200000
13/09/2024,CT nhanh 247 den: ngo bich ngoc ung ho ba con vung lu (CT1111),500000
13/09/2024,Chuyen tien den tu NAPAS Noi dung: GOP SUC NHO BE DEN DONG BAO GAP NAN- 130924-03:46:45 835125,100000
13/09/2024,CT nhanh 247 den: NGUYEN DUONG CANH chuyen tien (CT1111),100000
13/09/2024,CHAU KHANH KHAM chuyen tien,100000
13/09/2024,NGUYEN HUU HIEU Chuyen tien (CT1111),500000
13/09/2024,CT nhanh 247 den: MBVCB.7018407716.942121.L.A Green ung ho dong bao lu lut.,15000000
13/09/2024,66701057737-0582108109-HOANH THU TRANG chuyen tien qua MoMo,50000
13/09/2024,CT nhanh 247 den: NGUYEN THI THANH HUYEN chuyen tien,11000
13/09/2024,CT nhanh 247 den: cau mong dong bao co gang vuot qua.. (CT1111),150000
13/09/2024,CT nhanh 247 den: TRAN QUOC MINH CHUYEN TIEN,100000
13/09/2024,CT nhanh 247 den: MBVCB.7018415193.943170.TRAN THANH BINH chuyen tien Ung ho dong bao Vung Lu Mien Bac.,100000
13/09/2024,Nhom Future For All dong gop cuu tro bao so 3,10000000
13/09/2024,NGUYEN TRUONG DAI Chuyen tien (CT1111),100000
13/09/2024,Chuyen tien den tu NAPAS Noi dung: Ung ho dong bao thiet hai do con bao so 3 (CT1111),1000000
13/09/2024,CT nhanh 247 den: Vietinbank;CT1111;VU THI HAI chuyen tien ung ho dong bao phia bac bi lu lut (CT1111),300000
13/09/2024,CT nhanh 247 den: ung ho dong bao bi thiet hai (CT1111),300000
13/09/2024,Chuyen tien den tu NAPAS Noi dung: Ung ho ba con mua bao (CT1111),200000
13/09/2024,CT nhanh 247 den: HUYNH NHA TRUC chuyen tien cuu tro dong bao mien Bac (CT1111),1000000
13/09/2024,HA NHU NGOC chuyen tien (CT1111),50000
13/09/2024,CT nhanh 247 den: HOANG MAI chuyen tien khac phuc thien tai bao lu (CT1111),200000
13/09/2024,CT nhanh 247 den: THAY THUING MOI NGUOI MOI NGUOI CO LEN,30000
13/09/2024,NGUYEN VAN HUNG Chuyen tien (CT1111),100000
13/09/2024,ZP6R3FMSMRHI Chau kinh mong cho cac chien si bo doi di du ve du nhan dan binh an,200000
13/09/2024,Chuyen tien den tu NAPAS Noi dung: Mien bac co gang len nhe FT24257955326110 (CT1111),20000
13/09/2024,CT nhanh 247 den: UNG HO,500000
13/09/2024,Chuyen tien den tu NAPAS Noi dung: Mong dong bao dc binh an (CT1111),200000
13/09/2024,Chuyen tien den tu NAPAS Noi dung: Chuc moi nguoi suc khoe. Co gang len nhe (CT1111),50000
13/09/2024,CT nhanh 247 den: NGUYEN VAN PHUC chuyen tien (CT1111),1000000
13/09/2024,CT nhanh 247 den: NGUYEN HOANG NAM chuyen tien (CT1111),1000000
13/09/2024,CT nhanh 247 den: TRAN THI OANH gui tien,200000
13/09/2024,66700695962-0356053414-cau chuc cho dong bao minh binh an,500000
13/09/2024,DANH THI KIM TAI chuyen tien,300000
13/09/2024,ung ho vung lu (CT1111),500000
13/09/2024,CT nhanh 247 den: bay gio em khong con nhieu thang sau neu duoc em se ung ho nhieu hon mong la moi chuyen deu on (CT1111),40000
13/09/2024,Chuyen tien den tu NAPAS Noi dung: LE QUOC HAO chuyen tien tu Viettel Money,59000
13/09/2024,MACH THE HAN chuyen tien,500000
13/09/2024,CT nhanh 247 den: khanh linh chuyen tien ho tro bao lu (CT1111),46000
13/09/2024,LE THI THUY NGOC chuyen tien dong bao mien BAC (CT1111),1150000
13/09/2024,CAO XUAN PHUC chuyen tien (CT1111),200000
13/09/2024,CT nhanh 247 den: NGUYEN THI MINH CHAU chuyen tien ung ho dong bao yagi (CT1111),500000
13/09/2024,chuyen tien (CT1111),300000
13/09/2024,PHAN MINH THUAN ung ho dong bao mien bac,100000
13/09/2024,Ung ho ba con vung bao lu (CT1111),2000000
13/09/2024,Chuyen tien den tu NAPAS Noi dung: Quyen gop cho dong bao bi thiet hai do lu lut (CT1111),300000
13/09/2024,NGUYEN THI TINH chuyen tien,1000000
13/09/2024,Chuyen tien den tu NAPAS Noi dung: VU HOANG BAO ANH ung ho ho tro thiet hai bao Yagi FT24257134642218,100000
13/09/2024,Chuyen tien den tu NAPAS Noi dung: THU PHUONG ung ho dong bao bi bao lu (by TPBank ChatPay) (CT1111),100000
13/09/2024,Lua Gao Nep ung ho ba con Mien Bac (CT1111),5000000
13/09/2024,Chuyen tien den tu NAPAS Noi dung: VU TRUONG GIANG chuyen tien (Ct1111),500000
13/09/2024,CT nhanh 247 den: Vietinbank;CT1111;VU THI NGAN chuyen tien ung ho ba con vung lu (CT1111),300000
13/09/2024,CT nhanh 247 den: NGUYEN PHUONG THUY ung ho nguoi dan vung lu (CT1111),1000000
13/09/2024,CT nhanh 247 den: Vietinbank;111602391111;TRAN THI CAM LINH chuyen tien,200000
13/09/2024,CT nhanh 247 den: TRAN NGOC THUY THUONG chuyen tien (CT1111),1000000
13/09/2024,NGUYEN DUC THANG chuyen tien (CT1111),300000
13/09/2024,QUACH DAI DUONG chuyen tien,100000
13/09/2024,Ung ho dong bao bi bao lu (CT1111),500000
13/09/2024,CT nhanh 247 den: DINH THI TRANG chuyen tien (CT1111),2000000
13/09/2024,Chuyen tien den tu NAPAS Noi dung: IBFT Quyen gop cuu tro bao lu mien bac (CT1111),30000
13/09/2024,giup do nhan dan qua con bao Yagi (CT1111),1000000
13/09/2024,Chuyen tien den tu NAPAS Noi dung: BAOSO3 FT24257948445829 (CT1111),1000000
13/09/2024,Chuyen tien den tu NAPAS Noi dung: NGUYEN MANH HA chuyen FT24257032453396 (CT1111),100000
13/09/2024,TRUONG QUANG VUONG Chuyen tien dong gop cho vung anh huong con bao so 3,200000
13/09/2024,NGUYEN TAN DAT,1000000
13/09/2024,CT nhanh 247 den: XIN GUI MOT IT LONG THANH DEN MIEN BAC THAN YEU (CT1111),100000
13/09/2024,Chuyen tien den tu NAPAS Noi dung: cua it long nhieu (CT1111),100000
13/09/2024,Chuyen tien den tu NAPAS Noi dung: PHAM THI VIET ANH ung ho bao lu FT24257716190503 (CT1111),300000
13/09/2024,NGUYEN DUC QUAN Chuyen tien,300000
13/09/2024,CT nhanh 247 den: MBVCB.7018428713.953410.LE MINH DUC chuyen tien.,1000000
13/09/2024,ung ho dong bao mien bac (CT1111),1000000
13/09/2024,CT nhanh 247 den: NGUYEN THI TUYET LINH chuyen tien (CT1111),500000
13/09/2024,CT nhanh 247 den: Vietinbank;111602391111;TRAN DINH CONG chuyen tien ung ho,35496
13/09/2024,NGUYEN TAN PHUC Chuyen tien (CT1111),500000
13/09/2024,TRAN VIET HUNG chuyen tien,500000
13/09/2024,CT nhanh 247 den: MBVCB.7018429751.954449.Ung ho mua bao Mien Bac.,500000
13/09/2024,Chuyen tien den tu NAPAS Noi dung: NGUYEN DINH HUNG CHUYEN KHOAN BAN VAN DONG CUU TRO TRUNG UONG (ct1111),200000
13/09/2024,CT nhanh 247 den: PHAM QUYNH HOA chuyen tien (CT1111),20000
13/09/2024,CT nhanh 247 den: Nguyen Thi Oanh KDC Dam Cho Phu Thai Kim Thanh HD UH dong bao lu lut,500000
13/09/2024,VU THANH TU chuyen tien (CT1111),1000000
13/09/2024,NGUYEN BAO HUNG ung ho cuu tro (CT1111),100000
13/09/2024,PHAM THE DIEN chuyen tien,100000
13/09/2024,CT nhanh 247 den: NGUY THI HOA chuyen tien ung ho dong bao vung lu lut (CT1111),100000
13/09/2024,CT nhanh 247 den: Vietinbank;CT1111;LE HONG DIEM chuyen tien ung ho khac phuc bao yagi (CT1111),500000
13/09/2024,Chuyen tien den tu NAPAS Noi dung: Ho Sy Nam ung ho dong bao vung lu FT24257752720512 (CT1111),300000
13/09/2024,CT nhanh 247 den: NGUYEN QUANG DUNG chuyen tien,100000
13/09/2024,CT nhanh 247 den: unghodongbaovunglu,10000
13/09/2024,Khanh Luat o Binh Thuan cau mong ba con Mien Bac binh an sau con bao Yagi (CT1111),20000
13/09/2024,Chuyen tien den tu NAPAS Noi dung: Xin gop 1 phan nho be den dong bao bi anh huong boi bao va lu lut a (CT1111),200000
13/09/2024,Chuyen tien den tu NAPAS Noi dung: Pham Phuong Linh chuyen tien,100000
13/09/2024,CT nhanh 247 den: con hong co nhieu tien con xin gui it tam long cua minh den dong bao mien Bac chuc moi nguoi som vuot qua kho khan mong moi nguoi va cac chien si deu binh an a,50000
13/09/2024,CT nhanh 247 den: HO TRO DONG BAO LU LUT (CT1111),100000
13/09/2024,Chuyen tien den tu NAPAS Noi dung: IBFT MAI THANH PHONG chuyen tien (ct1111),20000
13/09/2024,Chuyen tien den tu NAPAS Noi dung: HO SY NAM ung ho dong bao vung lu FT24257008461255 (CT1111),300000
13/09/2024,Chuyen tien den tu NAPAS Noi dung: IBFT Ung ho dong bao (CT1111),200000
13/09/2024,CT nhanh 247 den: Vietinbank;ct1111;PHAM THI HUYEN NGA chuyen tien (ct1111),100000
