date,content,money
13/09/2024,CT nhanh 247 den: MBVCB.7018039309.694302. chuyen tien.,100000
13/09/2024,ung ho dong bao mien bac khac phuc bao lu (CT1111); thoi gian GD:12/09/2024 23:11:25,50000
13/09/2024,Chuyen tien den tu NAPAS Noi dung: HOANG BAO LAM CHUYEN KHOAN CUU TRO BAO-120924-23:11:25 762606,100000
13/09/2024,"Chuyen tien den tu NAPAS Noi dung: kinh mong ba con vuon qua bao lu, ha dong ha noi (ct1111)",100000
13/09/2024,Chuyen tien den tu NAPAS Noi dung: ung ho khac phuc hau qua lu lut (CT1111),500000
13/09/2024,CT nhanh 247 den: TRAN HUYNH QUANG DAT chuyen tien,23000
13/09/2024,Chuyen tien den tu NAPAS Noi dung: CHAU THUY TRAM chuyen tien (CT1111),200000
13/09/2024,Chuyen tien den tu NAPAS Noi dung: Xin ung ho Dong Bao lu Lut,200000
13/09/2024,Chuyen tien den tu NAPAS Noi dung: NGUYEN THI LAN ANH UNG HO UBTW MTTQ KHAC PHUC HAU QUA BAO YAGI- 120924-23:11:37 762700 (CT1111),200000
13/09/2024,CT nhanh 247 den: MBVCB.7018039598.694757.DAO TIEN MANH ung ho dong bao vung lu.,200000
13/09/2024,CT nhanh 247 den: UNG HO NGUOI DAN BI BAO LU (CT1111),50000
13/09/2024,CT nhanh 247 den: NGUYEN HOANG PHUC ung ho dong bao bi thiet hai do bao Yagi (CT1111),150000
13/09/2024,Chuyen tien den tu NAPAS Noi dung: IBFT Em xin dong gop phan nho cua minh ung ho cho dong bao (CT1111),500000
13/09/2024,Chuyen tien den tu NAPAS Noi dung: ZP242560427039 240912000795726 Dim Me chuyen tien qua Zalopay (CT1111),50000
13/09/2024,CT nhanh 247 den: trung tam tu van va giao duc hoa nhap Gia An Thai Ha ung ho nhan dan vung lu lut (CT1111),1200000
13/09/2024,CT nhanh 247 den: LE THI NHU NGUYEN GIA DINH NHA VOI UNG HO DONG BAO BAO LU. LA RACH IT DUM LA RACH NHIEU A (CT1111),100000
13/09/2024,NGUYEN THAO NHU ung ho dong bao mien Bac khac phuc hau qua sau bao va lu (CT1111); thoi gian GD:12/09/2024 23:11:55,500000
13/09/2024,Chuyen tien den tu NAPAS Noi dung: PHUNG THI THANH TAM 867909 CHIA SE KHO KHAN VOI DONG BAO LU LUT (ct1111),500000
13/09/2024,gop phan ho tro dong bao (CT1111); thoi gian GD:12/09/2024 23:12:00,200000
13/09/2024,NGUYEN NGOC UYEN VY chuc moi nguoi binh an; thoi gian GD:12/09/2024 23:12:01,200000
13/09/2024,Chuyen tien den tu NAPAS Noi dung: Nguyen Thi Huyen Dieu chuyen tien tu Viettel Money (CT1111),100000
13/09/2024,Chuyen tien den tu NAPAS Noi dung: hg ung ho FT24257028186832 (CT1111),3125
13/09/2024,Chuyen tien den tu NAPAS Noi dung: UNG HO DONG BAO (CT1111),500000
13/09/2024,66694291382-0916481215-LUONG MINH TAN chuyen tien qua MoMo; thoi gian GD:12/09/2024 23:12:12,500000
13/09/2024,Chuyen tien den tu NAPAS Noi dung: UNG HO DONG BAO BI ANH HUONG BAO SO 3- 120924-23:12:12 763030 (CT1111),5000000
13/09/2024,"Chuyen tien den tu NAPAS Noi dung: Ung ho ba con cac tinh phia Bac vuot qua bao lu, co len ba con oi (CT1111)",500000
13/09/2024,CT nhanh 247 den: NGUYEN THI NGAN chuyen tien (CT1111),20000000
13/09/2024,Chuyen tien den tu NAPAS Noi dung: Mien Bac co len (CT1111),50000
13/09/2024,CT nhanh 247 den: MBVCB.7018050197.696254.Xin duoc gop phan nho be ho tro dong bao chiu anh huong bao Yagi.,500000
13/09/2024,66694293139-0355156291-Ung ho dong bao bi thiet hai do Bao Hk duoc nhieu a; thoi gian GD:12/09/2024 23:12:26,30000
13/09/2024,CT nhanh 247 den: NGUYEN VAN TOAN CHUYEN TIEN,5000000
13/09/2024,CT nhanh 247 den: HUYNH NHAT QUANG chuyen tien (CT1111),200000
13/09/2024,LE DINH THUONG Chuyen tien (CT1111); thoi gian GD:12/09/2024 23:12:32,200000
13/09/2024,CT nhanh 247 den: LAM THANH DAT UNG HO DONG BAO BI LU LUT (CT1111),99999
13/09/2024,Gui ho tro dong bao mien bac bi anh huong bao Yagi; thoi gian GD:12/09/2024 23:12:42,1000000
13/09/2024,CT nhanh 247 den: hs mien nam quyen gop ho tro lu lut (CT1111),50000
13/09/2024,MAI KIEU OANH chuyen tien (CT1111); thoi gian GD:12/09/2024 23:12:45,200000
13/09/2024,"Chuyen tien den tu NAPAS Noi dung: NGUYEN HOAI NAM chuyen tien ung ho, khac phuc hau qua bao Yagi (CT1111)",200000
13/09/2024,Chuyen tien den tu NAPAS Noi dung: UNG HO NGUOI DAN MIEN BAC VUOT BAO- 120924-23:12:46 763345 (CT1111),500000
13/09/2024,CT nhanh 247 den: Vietinbank;111602391111;Chau muon gop chut long nho ung ho cac tinh bao lu a,100000
13/09/2024,Chuyen tien den tu NAPAS Noi dung: VU THI NGUYET chuyen tien ung ho dong bao Mien bac FT24257053177288,500000
13/09/2024,CT nhanh 247 den: MBVCB.7018051050.697341.TIEU TRUNG HIEU chuyen tien.,50000
13/09/2024,66694294055-0908738497-Ho tro ba con; thoi gian GD:12/09/2024 23:12:51,500000
13/09/2024,Chuyen tien den tu NAPAS Noi dung: Gia dinh Bao Bao ung ho mien Bac (CT1111),2000000
13/09/2024,Chuyen tien cuu tro bao Yagi (CT1111); thoi gian GD:12/09/2024 23:12:54,50000
13/09/2024,CT nhanh 247 den: MBVCB.7018041396.697235.GD Nhim.Soi xin gui tam long nho be den dong bao.,200000
13/09/2024,MONG BA CON SOM ON DINH CUOC SONG (CT1111); thoi gian GD:12/09/2024 23:12:56,500000
13/09/2024,CT nhanh 247 den: Vietinbank;CT1111;LE THI HUONG chuyen tien ung ho dong bao mien bac do bao lu (CT1111),500000
13/09/2024,DANG THI HUYNH GIAO Chuyen tien cua it long nhieu binh an nhe dong bao oi (CT1111); thoi gian GD:12/09/2024 23:13:02,100000
13/09/2024,Chuyen tien den tu NAPAS Noi dung: Ngo Huy Kiet chuyen tien tu Viettel Money (ct1111),100000
13/09/2024,Thuy dat uh (CT1111); thoi gian GD:12/09/2024 23:13:02,1000000
13/09/2024,la lanh dum la rach mong dong bao chung ta vuot qua kho khan (CT1111); thoi gian GD:12/09/2024 23:13:03,30000
13/09/2024,Chuyen tien den tu NAPAS Noi dung: PHAM KIM CHI chuyen tien (CT1111),100000
13/09/2024,Chuyen tien den tu NAPAS Noi dung: PHAM HAI ANH UNG HO DONG BAO MIEN BAC-120924-23:13:07 763571 (Ct1111),500000
13/09/2024,Chuyen tien den tu NAPAS Noi dung: Cung dong bao chung tay vuot qua kho khan (CT1111),100000
13/09/2024,Chuyen tien den tu NAPAS Noi dung: cong dan Dang Dinh Son xin duoc ung ho thiet hai do con bao so 3 va lu lut gay ra (CT1111),1000000
13/09/2024,Chuyen tien den tu NAPAS Noi dung: TRAN NHUT TAI UNG HO DONG BAO LU LUT-120924-23:13:11 763593 (CT1111),1000000
13/09/2024,CT nhanh 247 den: LE NGOC TUONG VY ung ho dong bao mien Bac (CT1111),100000
13/09/2024,SUNG THIN CO Chuyen tien; thoi gian GD:12/09/2024 23:13:13,20000
13/09/2024,Chuyen tien den tu NAPAS Noi dung: IBFT NGUYEN TUYET NGA ung ho dong bao (CT1111),200000
13/09/2024,CT nhanh 247 den: ung ho dong bao bao lut (CT1111),10000000
13/09/2024,CT nhanh 247 den: NGUYEN THI HUONG GIANG (CT1111),30000
13/09/2024,Chuyen tien den tu NAPAS Noi dung: cuu tro dong bao vuot qua con bao so 3 FT24257509387291 (CT1111),100000
13/09/2024,TRUONG NGUYEN NHI ho tro dong bao mien bac ;co len; thoi gian GD:12/09/2024 23:13:24,200000
13/09/2024,CT nhanh 247 den: Vietinbank;CT1111;Ung ho dong bao khac phuc thiet hai bao so 3 (CT1111),500000
13/09/2024,CT nhanh 247 den: NGUOI HAM MO BTS UNG HO DONG BAO MIEN BAC MONG MOI NGUOI VUOT QUA GIAI DOAN KHO KHAN NAY (CT1111),70000
13/09/2024,Chuyen tien den tu NAPAS Noi dung: LAM VIET HUNG chuyen tien ung ho dong bao chong lu FT24257893350931,1000000
13/09/2024,CT nhanh 247 den: HOANG NGOC HUYEN chuyen tien ho tro sau con bao YAGi (CT1111),100000
13/09/2024,Chuyen tien den tu NAPAS Noi dung: LE THI CAM TU Diep La Thien Tan chung tay cung dong bao mien bac vuot qua kho khan bao lut (CT1111),500000
13/09/2024,BUI THU TRANG chuyen tien (CT1111); thoi gian GD:12/09/2024 23:13:31,100000
13/09/2024,Ung Ho nguoi dan cau mong moi su may man (CT1111); thoi gian GD:12/09/2024 23:13:38,100000
13/09/2024,Chuyen tien den tu NAPAS Noi dung: Chung tay vi dong bao lu lut FT24257893350499 (CT1111),300000
13/09/2024,CT nhanh 247 den: DUONG PHAN HOANG ANH chuyen tien ung ho thien tai (CT1111),30000
13/09/2024,Nguyen Anh Dao con den tu 60 Dong Nai gui chut tam long den moi nguoi mien Trung (CT1111); thoi gian GD:12/09/2024 23:13:46,500000
13/09/2024,Ung ho dong bao thiet hai do bao so 3 (CT1111); thoi gian GD:12/09/2024 23:13:46,20000
13/09/2024,MAI THI CAM NHUNG chuyen tien; thoi gian GD:12/09/2024 23:13:47,100000
13/09/2024,CT nhanh 247 den: chung tay khac phuc bao YAGI (CT1111),3000000
13/09/2024,CT nhanh 247 den: TRAN THI BICH NGOC UNG HO VUNG ANH HUONG BAO SO 3 (Ct1111),200000
13/09/2024,"Chuyen tien den tu NAPAS Noi dung: Con khong co nhieu tien de giup do dong bao minh , nhung con mong tat ca dong bao co gang vuot qua (CT1111)",100000
13/09/2024,CT nhanh 247 den: ME CON CHAU SAM UNG HO NG DAN BAO YAGI,500000
13/09/2024,PHAN MAN LOC TU chuyen tien (CT1111); thoi gian GD:12/09/2024 23:13:50,200000
13/09/2024,Chuyen tien den tu NAPAS Noi dung: ung ho bao lu mien bac (CT1111),200000
13/09/2024,Chuyen tien den tu NAPAS Noi dung: PHAM TRUNG NGUYEN chuyen FT24257026645950 (CT1111),1000000
13/09/2024,CT nhanh 247 den: NGUYEN PHUONG NAM chuyen tien (CT1111),368000
13/09/2024,CT nhanh 247 den: MBVCB.7018052974.700211.Alaperfume.v n chuyen tien cuu tro MB lu lut.,1000000
13/09/2024,HUYNH SU MINH NHUAN chuyen tien ung ho dong bao bi thien tai; thoi gian GD:12/09/2024 23:14:08,500000
13/09/2024,CT nhanh 247 den: TRAN TU MINH CHUYEN TIEN (Ct1111),200000
13/09/2024,UNG HO DONG BAO CHIU ANH HUONG BAO LU LUT; thoi gian GD:12/09/2024 23:14:12,1000000
13/09/2024,NGUYEN THI NGOC VAN chuyen tien (CT1111); thoi gian GD:12/09/2024 23:14:22,88888
13/09/2024,Chuyen tien den tu NAPAS Noi dung: CHAU HAN UYEN cua it long nhieu chung tay ho tro dong bao mien Bac mua bao lu (CT1111),100000
13/09/2024,CT nhanh 247 den: gop chut ung ho dong bao (CT1111),100000
13/09/2024,HO TUYEN chuyen tien cuu tro dong bao mien bac (CT1111); thoi gian GD:12/09/2024 23:14:28,300000
13/09/2024,CT nhanh 247 den: Mot chut tam long cua con gui toi moi nguoi de vuot qua kho khan a (CT1111),50000
13/09/2024,ung ho dong bao mien bac (CT1111); thoi gian GD:12/09/2024 23:14:29,100000
13/09/2024,CT nhanh 247 den: VU THI SAO CHUYEN TIEN (CT1111),100000
13/09/2024,CT nhanh 247 den: DINH SY TUAN DAT chuyen tien cuu tro lu lut mien bac (CT1111),50000
13/09/2024,Chuyen tien den tu NAPAS Noi dung: Ho tro dong bao anh huong bao so 3 FT24257039190090 (CT1111),200000
13/09/2024,CT nhanh 247 den: MBVCB.7018053717.701431.Mong moi nguoi binh an.,200000
13/09/2024,CT nhanh 247 den: NGUYEN VAN VIET QUANG chuyen tien (CT1111),10000
13/09/2024,Chuyen tien den tu NAPAS Noi dung: LE TAN DAT chuyen FT24257079852259 (CT1111),100000
13/09/2024,CT nhanh 247 den: MBVCB.7018044837.701516.VUONG MINH HOANG chuyen tien.,205000
13/09/2024,Chuyen tien den tu NAPAS Noi dung: NGUYEN THI NGOAN chuyen tien tu ViettelMoney,50000
13/09/2024,Chuyen tien den tu NAPAS Noi dung: LE TRIEU KHANG ung ho khac phuc hau qua bao so 3 (CT1111),2000000
13/09/2024,Chuyen tien den tu NAPAS Noi dung: gd chau no nan.tk chau chi con nhieu day thoi- nhung chung ta la dong bao. la con nguoi. FT24257744399311 (CT1111),100000
13/09/2024,CT nhanh 247 den: Em be Dang cau mong ca nha binh an vuot qua bao lu yeu Viet Nam (CT1111),100000
13/09/2024,HUYNH PHUONG ANH chuyen tien; thoi gian GD:12/09/2024 23:14:51,200000
13/09/2024,"CT nhanh 247 den: MBVCB.7018045028.701751.LE PHU XUYEN, TP.Dong Ha, Quang Tri chuyen ung ho lu lut Mien Bac.",1000000
13/09/2024,CT nhanh 247 den: MBVCB.7018055194.701939.NGUYEN VIET TRUONG chuyen tien ung ho bao yagi.,600000
13/09/2024,HOANG THI NGUYEN HIEN chuyen tien ung ho dong bao lu lut (CT1111); thoi gian GD:12/09/2024 23:14:56,500000
13/09/2024,DINH TRAN KIEU DIEM NGOC Chuyen tien (CT1111); thoi gian GD:12/09/2024 23:14:56,500000
13/09/2024,ung ho dong bao bi anh huong boi bao Yagi (CT1111); thoi gian GD:12/09/2024 23:15:01,150000
13/09/2024,Chuyen tien den tu NAPAS Noi dung: UNG HO DONG BAO MIEN BAC,200000
13/09/2024,Chuyen tien den tu NAPAS Noi dung: NGO THI THU HIEN chuyen tien,200000
13/09/2024,Chuyen tien den tu NAPAS Noi dung: Dong bao mien Bac co len (CT1111),55555
13/09/2024,LAI THI TUYET LAM gop chut suc mon cung dong bao minh (CT1111); thoi gian GD:12/09/2024 23:15:05,100000
13/09/2024,Chuyen tien den tu NAPAS Noi dung: NGUYEN DINH HUY UNG HO-120924- 23:15:05 764626 (CT1111),500000
13/09/2024,Chuyen tien den tu NAPAS Noi dung: LE HUY PHONG chuyen FT24257512243781 (CT1111),500000
13/09/2024,Chuyen tien den tu NAPAS Noi dung: Dan toc Viet Nam FT24257907001990 (CT1111),100000
13/09/2024,Chuyen tien den tu NAPAS Noi dung: IBFT ung ho khac phuc hau qua bao yagi (CT1111),200000
13/09/2024,Chuyen tien den tu NAPAS Noi dung: UNG HO THIEN TAI BAO LU-120924-23:15:10 764634 (CT1111),200000
13/09/2024,DTHa ung ho DB bao lu Yagi (CT1111); thoi gian GD:12/09/2024 23:15:11,300000
13/09/2024,VU TRONG SANG Chuyen tien gop suc cuu tro dong bao bi anh huong bao lu (CT1111); thoi gian GD:12/09/2024 23:15:14,100000
13/09/2024,Chuyen tien den tu NAPAS Noi dung: OG28-Ten Plus 2024 THPT CNN Ho tro chong bao lu a FT24257621856616,280000
13/09/2024,CT nhanh 247 den: ung ho dong bao (CT1111),100000
13/09/2024,BUI VAN HUNG Chuyen tien; thoi gian GD:12/09/2024 23:15:20,50000
13/09/2024,CT nhanh 247 den: MBVCB.7018056064.702963.LY PHUC QUANG chuyen tien cuu tro dong bao mien Bac.,200000
13/09/2024,CT nhanh 247 den: MONG DONG BAO MIEN BAC VUOT QUA THIEN TAI LAN NAY. BAC TRUNG NAM LA MOT.,50000
13/09/2024,Chung tay ung ho dong bao (CT1111); thoi gian GD:12/09/2024 23:15:25,200000
13/09/2024,TRAN THI THANH THAO; thoi gian GD:12/09/2024 23:15:34,50000
13/09/2024,CAO TUAN MINH chuyen tien ho tro chong lu (CT1111); thoi gian GD:12/09/2024 23:15:35,20000
13/09/2024,NGUYEN THU HUYEN chuyen tien; thoi gian GD:12/09/2024 23:15:37,300000
13/09/2024,HUYNH VU KHANH BANG chuyen tien; thoi gian GD:12/09/2024 23:15:37,100000
13/09/2024,CT nhanh 247 den: Vietinbank;CT1111;Fan soobin tham gia ung ho dong bao mien bac bi anh huong bao lu cung idol (CT1111),100000
13/09/2024,mong dong bao binh an vuot qua thoi gian nay; thoi gian GD:12/09/2024 23:15:39,30000
13/09/2024,Chuyen tien den tu NAPAS Noi dung: XA THANH HUYEN chuyen tien,200000
13/09/2024,CT nhanh 247 den: Vietinbank;ct1111;BUI BA GIAM chuyen tien cuu tro bao so 3 (ct1111),500000
13/09/2024,CT nhanh 247 den: Lai Ngoc Thao hy vong moi nguoi deu an toan (CT1111),200000
13/09/2024,NGUYEN VAN MANH chuyen tien (CT1111); thoi gian GD:12/09/2024 23:15:42,1000000
13/09/2024,Chuyen tien den tu NAPAS Noi dung: ung ho dong bao cac tinh phia bac FT24257842426156 (CT1111),1000000
13/09/2024,Ung Ho Dong Bao Mien Bac; thoi gian GD:12/09/2024 23:15:45,200000
13/09/2024,NGO NGOC NHI chuyen tien; thoi gian GD:12/09/2024 23:15:49,10000
13/09/2024,Ung ho dong bao mien Bac bi thiet hai do con bao Yagi (CT1111); thoi gian GD:12/09/2024 23:15:51,100000
13/09/2024,MUHAMAD RONI chuyen tien; thoi gian GD:12/09/2024 23:15:52,100000
13/09/2024,Chuyen tien den tu NAPAS Noi dung: Tran Thi Thu Kieu gui mien bac ho tro bao lu (CT1111),200000
13/09/2024,CT nhanh 247 den: TAP THE LOP QLTT14A K65 TRUONG DAI HOC VAN HOA HA NOI UNG HO VUNG THIEN TAI (CT1111),880000
13/09/2024,Chuyen tien den tu NAPAS Noi dung: IBFT Ung ho dong bao anh huong lu lut (CT1111),100000
13/09/2024,Chuyen tien den tu NAPAS Noi dung: UNG HO CUU TRO BAO YAGI-120924-23:16:03 765036 (ct1111),500000
13/09/2024,CT nhanh 247 den: THANH THAO GOP XIU XIU (CT1111),20000
13/09/2024,Chuyen tien den tu NAPAS Noi dung: Ung ho nhan dan mien Bac - Viet Nam co len FT24257201203461,150000
13/09/2024,CT nhanh 247 den: LE TRAN DUC HUY CHUYEN TIEN (CT1111),100000
13/09/2024,TIEU DOAN PHUONG MO chuyen tien; thoi gian GD:12/09/2024 23:16:10,50000
13/09/2024,Chuyen tien den tu NAPAS Noi dung: ung ho dong bao nan nhan bao lu (CT1111),1000000
13/09/2024,Chuyen tien den tu NAPAS Noi dung: xin dong gop chut suc nho cuu tro dong bao vung bao lu (by TPBank ChatPay) (CT1111),500000
13/09/2024,CT nhanh 247 den: Con Vo Manh Khang xin gop chut tien ung ho cuu ho chong bao Yagi,200000
13/09/2024,CT nhanh 247 den: Ung Ho Dong Bao Lu Lut,50000
13/09/2024,DUONG THI NUONG Chuyen tien (CT1111); thoi gian GD:12/09/2024 23:16:18,500000
13/09/2024,Chuyen tien den tu NAPAS Noi dung: Co len dong bao oi FT24257901284359,1000000
13/09/2024,SU NU HOAN NHI chuyen tien ung ho dong bao bi thiet hai do bao so 3 (CT1111); thoi gian GD:12/09/2024 23:16:32,300000
13/09/2024,CT nhanh 247 den: NGUYEN TIEN DAT CHUYEN TIEN (CT1111),50000
13/09/2024,CT nhanh 247 den: ung ho nho (CT1111),100000
13/09/2024,DO XUAN DUNG ung ho dong bao bi bao lut (CT1111); thoi gian GD:12/09/2024 23:16:36,100000
13/09/2024,CT nhanh 247 den: MBVCB.7018057206.704314.HO YEN NHI chia se voi dong bao bi lu lut.,500000
13/09/2024,66694442995-0989406425-TRAN HOAI ANH THU chuyen tien; thoi gian GD:12/09/2024 23:16:39,500000
13/09/2024,TRAN THI THU HIEN chung tay giup dong bao ca nuoc khac phuc hau qua thien tai (CT1111); thoi gian GD:12/09/2024 23:16:41,200000
13/09/2024,PHAN THI HONG DOAN chuyen tien ho tro ba con lu lut (CT1111); thoi gian GD:12/09/2024 23:16:44,300000
13/09/2024,Chuyen tien den tu NAPAS Noi dung: QUACH KHANH LINH MIEN BAC CO LEN (CT1111),50000
13/09/2024,CT nhanh 247 den: MBVCB.7018058456.705742.PHAM NGUYEN THANH DANH chuyen tien.,50000
13/09/2024,NGUYEN THI LAN Chuyen tien; thoi gian GD:12/09/2024 23:16:49,200000
13/09/2024,NGUYEN QUOC THAI chuyen tien (CT1111); thoi gian GD:12/09/2024 23:16:52,100000
13/09/2024,Chuyen tien den tu NAPAS Noi dung: LAI PHUONG THAO chuyen Viet Nam dong long vuot qua kho khan bao lu FT24257126549756 (CT1111),225000
13/09/2024,Chuyen tien den tu NAPAS Noi dung: IBFT Mien Bac co len (CT1111),50000
13/09/2024,CT nhanh 247 den: MBVCB.7018059145.706533.TRAN HIEU NGAN UNG HO DONG BAO LU LUT.,100000
13/09/2024,Chuyen tien den tu NAPAS Noi dung: TRUONG THI THU HIEN chuyen tien FT24257298204380,100000
13/09/2024,CT nhanh 247 den: NGUYEN VAN HOANG PHU ung ho dong bao mong mn som vuot qua kho khan,200000
13/09/2024,Chuyen tien den tu NAPAS Noi dung: hope everything is better (CT1111),100000
13/09/2024,CT nhanh 247 den: MIEN BAC O CO LEN MIEN TRUNG TRUNG CHUNG TO LUON HUONG VE CAC BAN HAY CO GANG VUOT QUA THIEN TAI NAY NHE (CT1111),10000
13/09/2024,Chuyen tien den tu NAPAS Noi dung: VU THUY TRANG ung ho ba con mien Bac,1000000
13/09/2024,NGUYEN THI HOP xin duoc dong gop khac phuc hau qua bao YaGi; thoi gian GD:12/09/2024 23:17:24,500000
13/09/2024,Chuyen tien den tu NAPAS Noi dung: ISL20240912231726099-LE THI HONG NHO chuyen tien (CT1111),50000
13/09/2024,Chuyen tien den tu NAPAS Noi dung: PHAM THI YEN ung ho nguoi dan bi anh huong bao lu FT24257889642606 (CT1111),200000
13/09/2024,Chia se chut it voi dong bao vung lu lut. Mong tat ca binh an; thoi gian GD:12/09/2024 23:17:31,500000
13/09/2024,NGUYEN DAO QUYNH ANH ung ho dong bao bi thiet hai do bao yagi; thoi gian GD:12/09/2024 23:17:31,50000
13/09/2024,CT nhanh 247 den: NGUYEN LE LINH CHI chuyen tien,70000
13/09/2024,Ha May Ung Ho Mien Bac vuot qua con bao so 3 - yagi; thoi gian GD:12/09/2024 23:17:37,100000
13/09/2024,Chuyen tien den tu NAPAS Noi dung: NGUYEN DUY HIEU chuyen FT24257609568512 (CT1111),20000
13/09/2024,CT nhanh 247 den: fb thu spring (CT1111),2000000
13/09/2024,Chuyen tien den tu NAPAS Noi dung: VO KHANH LINH chuyen tien qua MoMo (CT1111),50000
13/09/2024,CT nhanh 247 den: QUYEN GOP UNG HO DONG BAO (CT1111),200000
13/09/2024,CT nhanh 247 den: Vietinbank;ct1111;PHAM VAN LONG Hang ung ho dan vung lu (ct1111),2000000
13/09/2024,Chuyen tien den tu NAPAS Noi dung: cao sama FT24257538064777 (CT1111),200000
13/09/2024,CT nhanh 247 den: nam mo a di da phat (CT1111),50000
13/09/2024,CT nhanh 247 den: BUI NGUYEN ANH KHOA chuyen tien (CT1111),100000
13/09/2024,Hoc sinh Mien Nam ung ho nguoi dan Mien Bac - e nguoi nho viec nho so tien it nhung xin ung ho; thoi gian GD:12/09/2024 23:17:50,20000
13/09/2024,DINH LE BAO TRAN ung ho dong bao vung lu (CT1111); thoi gian GD:12/09/2024 23:17:55,500000
13/09/2024,CHUN PANHA chuyen tien (CT1111); thoi gian GD:12/09/2024 23:17:56,100000
13/09/2024,Chau PHAM THU THUY ung ho dong bao bi anh huong cua bao lu a; thoi gian GD:12/09/2024 23:17:58,200000
13/09/2024,TRINH LE NHU QUYNH ung ho cuu tro nhan dan (CT1111); thoi gian GD:12/09/2024 23:17:58,50000
13/09/2024,Chuyen tien den tu NAPAS Noi dung: Nhung Nhi ung ho dong bao bi thiet hai do lu gay ra,500000
13/09/2024,NGUYEN TUAN LINH ho tro bl (CT1111); thoi gian GD:12/09/2024 23:18:05,100000
13/09/2024,DUY TRANG ung ho ba con vuot qua con bao; thoi gian GD:12/09/2024 23:18:09,150000
13/09/2024,LANH THU THAO chuyen tien (CT1111); thoi gian GD:12/09/2024 23:18:12,20000
13/09/2024,PHAN MINH TRONG chuyen tien; thoi gian GD:12/09/2024 23:18:13,80000
13/09/2024,CT nhanh 247 den: UNG HO DONG BAO BAO LU (CT1111),1000000
13/09/2024,CT nhanh 247 den: chau chi con trong tk tung nay tien xin gop suc nho cau mong dong bao binh an (CT1111),20000
13/09/2024,Chuyen tien den tu NAPAS Noi dung: PHAN HUY TRUONG ung ho mien bac a. (CT1111),100000
13/09/2024,Chuyen tien den tu NAPAS Noi dung: VO PHAM ANH DAO chuyen tien (CT1111),50000
13/09/2024,LE THI THANH THAO tu HP ung ho ba con vung lu (CT1111); thoi gian GD:12/09/2024 23:18:23,500000
13/09/2024,Chuyen tien den tu NAPAS Noi dung: Cuu CB Truong Huong ung ho Dong Bao chiu thien tai lu lut FT24257142016559 (CT1111),500000
13/09/2024,CT nhanh 247 den: CK UNG HO LU LUT (CT1111),50000
13/09/2024,CT nhanh 247 den: TRUONG DINH QUYET CHUYEN TIEN (CT1111),100000
13/09/2024,BUI THI NA Chuyen tien (CT1111); thoi gian GD:12/09/2024 23:18:28,20000
13/09/2024,Chuyen tien den tu NAPAS Noi dung: NGUYEN VAN THANG chuyen tien (CT1111),3130
13/09/2024,Chuyen tien den tu NAPAS Noi dung: Gia dinh chau Anh ung ho nguoi dan bi ngap lut,200000
13/09/2024,CT nhanh 247 den: NGUYEN MINH TRA CHUYEN TIEN,500000
13/09/2024,CT nhanh 247 den: QUACH THI KIM ANH GOI NGUOI DAN MIEN BAC CHONG BAO (CT1111),300000
13/09/2024,Chuyen tien den tu NAPAS Noi dung: ung ho dong bao vuot qua kho khan (CT1111),500000
13/09/2024,CT nhanh 247 den: MBVCB.7018062062.709872.TRAN NGUYEN NGUYEN ANH cuu tro Mien Bac.,2000000
13/09/2024,Chuyen tien den tu NAPAS Noi dung: LY NHA KY chuyen khoan-120924-23:18:38 766342,103000
13/09/2024,MOI NGUOI CO LEN; thoi gian GD:12/09/2024 23:18:40,50000
13/09/2024,Chuyen tien den tu NAPAS Noi dung: NGUYEN NGOC NAM chuyen tien (CT1111),300000
13/09/2024,Chuyen tien den tu NAPAS Noi dung: Ngo Tran Linh Linh chuyen tien,400000
13/09/2024,Chuyen tien den tu NAPAS Noi dung: chau uh dong bao bao lu a (CT1111),500000
13/09/2024,Chuyen tien den tu NAPAS Noi dung: Ho tro dong bao bi lu lut,300000
13/09/2024,Chuyen tien den tu NAPAS Noi dung: Nguyen Lam Phuc anh cua Tuan Anh Giang ung ho ba con bao lu (CT1111),139000
13/09/2024,LE NGUYEN PHU AN ung ho khac phuc bao Yagi; thoi gian GD:12/09/2024 23:18:55,300000
13/09/2024,Chuyen tien den tu NAPAS Noi dung: NGUYEN THI HUONG ung ho dong bao bi lu lut FT24257452526401,500000
13/09/2024,Chuyen tien den tu NAPAS Noi dung: DINH HOANG PHONG chuyen FT24257345795750 (CT1111),3000000
13/09/2024,Chuyen tien den tu NAPAS Noi dung: HA CONG THANH xin duoc dong gop 1 phan nho vao quy FT24257385212305,36000
13/09/2024,HA ANH TUAN chuyen tien ho tro quyen gop dong thiet hai do bao so 3 (CT1111); thoi gian GD:12/09/2024 23:18:59,500000
13/09/2024,DAO THI THAO chuyen tien; thoi gian GD:12/09/2024 23:19:07,500000
13/09/2024,66693414954-0329756310-NGOC THI PHUONG chuyen tien qua MoMo; thoi gian GD:12/09/2024 23:19:07,18000
13/09/2024,CT nhanh 247 den: MBVCB.7018063177.711214.NGUYEN THUY TRANG chuyen tien.,90000
13/09/2024,PHAM ANH LINH chuyen tien ung ho dong bao bao yagi (CT1111); thoi gian GD:12/09/2024 23:19:10,100000
13/09/2024,Chuyen tien den tu NAPAS Noi dung: NGUYEN HA LAN ANH chuyen tien qua MoMo (CT1111),100000
13/09/2024,ung ho khac phuc hau qua bao yagi (CT1111); thoi gian GD:12/09/2024 23:19:11,100000
13/09/2024,Chuyen tien den tu NAPAS Noi dung: IBFT Cuu tro mien bac (CT1111),100000
13/09/2024,chau gop chut it a (CT1111); thoi gian GD:12/09/2024 23:19:15,10000
13/09/2024,CT nhanh 247 den: NGUYEN THI THUY DUONG CHUYEN TIEN UNG HO (CT1111),500000
13/09/2024,Chuyen tien den tu NAPAS Noi dung: Chuyen tien ung ho dong bao mien Bac bi lu lut (CT1111),1000000
13/09/2024,CT nhanh 247 den: NGUYEN THI PHUONG THAO CHUNG TAY UNG HO DONG BAO MIEN BAC (CT1111),100000
13/09/2024,NGHIEM ANH VAN Chuyen tien (CT1111); thoi gian GD:12/09/2024 23:19:23,100000
13/09/2024,NGUYEN NGOC KIEU THANH chuyen tien ung ho khac phuc sau bao; thoi gian GD:12/09/2024 23:19:24,1000000
13/09/2024,PHUNG TIEN TOAN chuyen tien (CT1111); thoi gian GD:12/09/2024 23:19:28,10000
13/09/2024,CT nhanh 247 den: CAO THI HIEN chuyen tien ung ho dong bao lu lut (CT1111),300000
13/09/2024,Chuyen tien den tu NAPAS Noi dung: Mong ba con luon binh an vuot qua bao lu an toan,100000
13/09/2024,CT nhanh 247 den: Ung ho dong bao bi lu lut (CT1111),1000000
13/09/2024,Chuyen tien den tu NAPAS Noi dung: TA THI MUOI chuc tam long khong nhieu mong ba con vuot qua (CT1111),100000
13/09/2024,TRAN THI HAI NAM chuyen tien; thoi gian GD:12/09/2024 23:19:40,5000000
13/09/2024,ung ho dong bao lu lut mien bac (CT1111); thoi gian GD:12/09/2024 23:19:44,500000
13/09/2024,66694173731-0961106240-Ung ho ba con vung lu; thoi gian GD:12/09/2024 23:19:48,50000
13/09/2024,Chuyen tien den tu NAPAS Noi dung: NGUYEN QUOC VU chia se voi dong bao bi lu lut a (CT1111),5000
13/09/2024,NGUYEN THI PHUONG HONG chuyen tien ung ho bao yagi (CT1111); thoi gian GD:12/09/2024 23:19:56,200000
13/09/2024,Chuyen tien den tu NAPAS Noi dung: Ung ho dong bao vuot qua lu FT24257329214317 (CT1111),200000
13/09/2024,Chuyen tien den tu NAPAS Noi dung: NGUYEN THI DIEU LINH HP ung ho FT24257979065110 (CT1111),500000
13/09/2024,Chuyen tien den tu NAPAS Noi dung: HO HUYEN LINH chuyen cuu tro thien tai FT24257880699577 (CT1111),300000
13/09/2024,CT nhanh 247 den: DO PHAN NHU Y chuyen tien (CT1111),10000
13/09/2024,Chuyen tien den tu NAPAS Noi dung: Chung tay gop suc khac phuc thiet hai bao Yagi (CT1111),1000000
13/09/2024,HO THI PHAN DIEP Chuyen tien (CT1111); thoi gian GD:12/09/2024 23:20:13,20000
13/09/2024,CT nhanh 247 den: Ung ho dong bao lu lut (CT1111),30000
13/09/2024,CT nhanh 247 den: BT HAM SHOP LINH NOI THAT AN NHIEN CHUYEN TIEN,1000000
13/09/2024,CT nhanh 247 den: PHAN THUC HAN CHUYEN TIEN (CT1111),500000
13/09/2024,ung ho khac phuc hau qua thien tai (CT1111); thoi gian GD:12/09/2024 23:20:44,1000000
